Column1;Column2;Column3;Column4;Column5;Column6;Column7;Column8
Domanda;RispostaA;RispostaB;RispostaC;Risposta Esatta;;;
Qual è la funzione del collarino in un bossolo?;Puramente estetica;Tenere  insieme  parte  metallica  e non metallica della cartuccia;Agganciare l’estrattore;c;;;
Quante cartucce a munizione spezzata si possono detenere senza obbligo di denuncia?;Massimo 1.000;Massimo 1.500;Massimo 2.000;a;;;
Quale delle seguenti armi è idonea per la caccia di selezione al camoscio?;Carabina semiautomatica;Carabina bolt-action;Semiautomatico a canna liscia;b;;;
Quante  cartucce  da  caccia  a  palla   si  possono detenere senza obbligo di denuncia?;Massimo 50;Massimo 100;Anche una sola va denunciata;c;;;
Prima  di  superare  un  fosso,  cosa  deve  fare  il cacciatore?;Mettere il fucile in sicura;Smontare il fucile;Non necessita alcuna precauzione;a;;;
Fino a quanti metri con fucile cal. 12 e cartuccia idonea si può abbattere un fagiano?;100/150 metri;80/100 metri;30/40 metri;c;;;
Quale   dei   seguenti   fucili   ad   anima   liscia   è consentito per la caccia?;Cal. 8;Cal. 10;Cal. 16;c;;;
In  una  carabina  cal.  240  Weatherby  il  calibro  è espresso in:;Millimetri;Millesimi di pollice;Centesimi di pollice;b;;;
In  una  carabina  cal.  300  Winchester  il  calibro  è espresso in:;Centesimi di pollice;Millimetri;Millesimi di pollice;c;;;
Cosa blocca la sicura in un fucile ad anima liscia?;Il grilletto;Il percussore;La chiave di apertura dell’arma;a;;;
Quali dei seguenti pallini hanno diametro minore?;Pallini n. 11;Pallini n. 9;Pallini n. 10;a;;;
Per quale delle seguenti armi è consentito l’utilizzo venatorio?;Carabina ad aria compressa cal. 4,5 mm;Fucile ad anima liscia cal. 36;Carabina cal. 22;b;;;
Quando il vento può avere un effetto significativo sulla traiettoria di un tiro a palla?;Quando soffia nella stessa direzione della traiettoria;Quando  soffia  trasversalmente  alla traiettoria;Quando   soffia   in   direzione   opposta   alla traiettoria;b;;;
Che pallini sono più indicati per cacciare anatre di media taglia come mestolone e fischione?;Del n. 5;Del n. 8;Del n. 10;a;;;
Quale delle seguenti armi è a canna rigata?;Un sovrapposto cal. 12;Un semiautomatico cal. 20;Una carabina cal. 30.06;c;;;
Come si chiama la parte anteriore della canna?;Bascula;Volata;Culatta;b;;;
Qual è il calibro massimo consentito per la caccia nelle armi ad anima liscia?;Cal. 12;Cal. 20;Cal. 36;a;;;
Per  quale  ungulato  è  consentita  la  caccia  con munizione a palla unica per canna ad anima liscia?;Il capriolo;Il cinghiale;Il muflone;b;;;
Quanto è lunga generalmente la canna in un fucile da caccia ad anima liscia?;90 cm;70 cm;50 cm;b;;;
Quando è da considerarsi in posizione di sicurezza un fucile Hammerless?;Quando i cani sono abbassati;Quando i cani sono alzati;Quando  l’apposita  levetta  è  in  posizione  di sicurezza;c;;;
Domanda;RispostaA;RispostaB;RispostaC;Risposta Esatta;;;
Quale dei seguenti calibri è più idoneo per la caccia ai Turdidi da appostamento fisso?;Il cal. 10;Il cal. 28;Il cal. 12;b;;;
Per la caccia alla stanziale quale di questi calibri di fucile è preferibile?;Il cal. 24;Il cal. 12;Il cal. 410;b;;;
Quale dei seguenti tipi d’arma è a canna rigata?;Il semiautomatico;Il sovrapposto;L’express a canne giustapposte;c;;;
La denuncia di un’arma da caccia a chi deve essere presentata?;Alla Questura o ai Carabinieri;Alla Polizia provinciale;Alla Regione;a;;;
Quali   pallini   sono   consigliabili   per    la   caccia all’allodola?;Del n. 10 o 11;Del n. 6 o 7;Del n. 4 o 5;a;;;
Qual è la carica standard di pallini di una cartuccia cal. 20?;36 gr;32 gr;24 gr;c;;;
Quali  pallini  sono  consigliabili  per  la  caccia  alla beccaccia?;Del n. 3 o 4;Del n. 9 o 10;Del n. 5 o 6;b;;;
Quali  pallini  sono  consigliabili  per  la  caccia  alla starna?;Del n. 3 o 4;Del n. 9 o 10;Del n. 6 o 7;c;;;
Quali  pallini  sono  consigliabili  per  la  caccia  al merlo?;Del n. 10 o 11;Del n. 7 o 8;Del n. 5 o 6;a;;;
Quali  pallini  sono  consigliabili  per  la  caccia  alla quaglia?;Del n. 7 o 8;Del n. 10 o 11;Del n. 4 o 5;b;;;
Quali   pallini   sono   consigliabili   per    la   caccia all’alzavola?;Del n. 8 o 9;Del n. 3 o 4;Del n. 6 o 7;c;;;
Quando è consigliabile utilizzare cartucce caricate con dosi minime di polvere e piombo?;A inizio stagione venatoria;In pieno inverno;Sempre;a;;;
Che cos’è il raccordo tronco-conico nella canna del fucile?;La  parte  che  unisce  la  camera  di scoppio all’anima della canna;La parte che unisce il vivo di volata con l’anima della canna;La parte che unisce la volata con la bascula;a;;;
Fino   a   che   distanza   è   normalmente   possibile abbattere una lepre comune con pallini n. 3?;40 metri;80 metri;100 metri;a;;;
Fino    che    distanza    è    normalmente    possibile abbattere un tordo bottaccio con pallini n. 10?;60 metri;75 metri;35 metri;c;;;
Fino    che    distanza    è    normalmente    possibile abbattere un fagiano con pallini n. 6?;90 metri;60 metri;30 metri;c;;;
Come  può  essere  la  chiusura  del  bossolo  di una cartuccia a munizione spezzata?;Stellare;Piramidale;Esagonale;a;;;
Di quanti grammi è all’incirca la dose normale di piombo nel cal. 12?;20 gr;25 gr;32 gr;c;;;
Che cos’è il borraggio in una cartuccia?;L’elemento interposto tra polvere e piombo;La parte di bossolo a chiusura della cartuccia;Il fondello interno del bossolo;a;;;
Domanda;RispostaA;RispostaB;RispostaC;Risposta Esatta;;;
Quale  delle  seguenti  strozzature  in  un  fucile  a canna liscia è maggiore?;Due stelle;Tre stelle;Una stella;c;;;
Durante l’esercizio venatorio è consentito portare con sé utensili da punta o da taglio?;No, perché la licenza di caccia abilita solo al porto d’armi da fuoco;Sì, se sono utensili atti alle esigenze venatorie;E’  consentito  a  chi  sia  titolare  di  licenza  di caccia da almeno 10 anni;b;;;
Quanti colpi ha un fucile semiautomatico ad anima liscia?;Uno;Due;Più di due;c;;;
Con  quale  delle  seguenti  armi  è  consentita  la caccia?;Fucile cal. 22;Carabina ad aria compressa;Doppietta cal. 20;c;;;
In  quale  forma  di  caccia  si  può  utilizzare  con profitto una carabina semiautomatica?;Caccia al capriolo da altana;Caccia al cinghiale in braccata;Caccia al cervo al bramito;b;;;
Quale di questi calibri è più potente?;Il cal. 28;Il cal. 12;Il cal. 36;b;;;
Che cosa s’intende per munizione spezzata?;La cartuccia caricata a pallini;La   cartuccia   caricata   a   palla   con frattura predisposta a schegge;La cartuccia tagliata a metà senza piombo per tiro a salve;a;;;
Come  sono  denominate  le  munizioni  a  palla  per canna rigata non contenenti piombo?;Camiciate;Monolitiche;Rinforzate;b;;;
Quali munizioni spezzate sono sempre vietate per la caccia nella zona Alpi?;Quelle    con    pallini    di    diametro superiore a 4 mm;Quelle    con    pallini    di    diametro inferiore a 4 mm;Quelle con pallini di numerazione inferiore al 7;a;;;
È consentito usare per la caccia una carabina cal. 22?;Sì senza limitazioni;Mai;Sì ma solo per la caccia alla volpe;b;;;
Cos’è l’asta in un fucile?;Una parte dell’impugnatura;Una parte della bascula;Una parte delle canne;a;;;
Dov’è la sicura in un fucile ad anima liscia a cani esterni?;Sopra la croce;Di fianco al grilletto;Sono i cani abbassati;c;;;
Che  pallini  sono  consigliabili  per  la  caccia  alla cesena?;Del n. 9 o 10;Del n. 6 o 7;Del n. 4 o 5;a;;;
In  una  doppietta  o  un  sovrapposto  l’estrattore manuale sarà in:;Un pezzo unico;Due pezzi;Senza il collarino;a;;;
In  una  doppietta  o  un  sovrapposto  l’estrattore automatico sarà in:;Un pezzo unico;Due pezzi;Senza il collarino;b;;;
Terminata la giornata di caccia, perché è consigliabile usare i salvapercussori per scaricare l’arma?;Per evitare di rompere i percussori;È solo una consuetudine;Per sbloccare la sicura;a;;;
Nei fucili dotati di monogrillo meccanico, se non è partito il primo colpo può partire il secondo?;Sì;No, perché la massa non aggancia il cane;No, perché si aziona la sicura;b;;;
In  un  sovrapposto  con  due  grilletti,  premendo  il primo grilletto quale canna spara?;Inferiore;Superiore;Entrambe;a;;;
In una doppietta o sovrapposto, che funzione ha la croce?;Arma le batterie;Modifica la strozzatura;Piega il calcio;a;;;
Domanda;RispostaA;RispostaB;RispostaC;Risposta Esatta;;;
Per  quale  motivo  si  consiglia  di  non  lasciare  le batterie dell’arma cariche per un lungo periodo?;Per    evitare    l’indebolimento    della molla;Per non bloccare l’azione della sicura;Per non compromettere le chiusure;a;;;
Le cartucce a palla denominate “monolitiche” che lunghezza hanno, a parità di peso, rispetto a quelle in piombo?;Sono più lunghe;Sono più corte;Sono di pari lunghezza;a;;;
In un sovrapposto con strozzatura 2 stelle/1 stella come si possono allargare le rosate senza manomettere le canne?;Usando cartucce dispersanti;Usando       cartucce       con       borra contenitore;Usando cartucce con capsule rigate;a;;;
Quale adempimento occorre se si detiene, anche per breve periodo, l’arma in un luogo diverso da quello di denuncia?;Avvisare l’autorità di P.S.;Non occorre fare nulla;Avvisare la Prefettura;a;;;
Il “calibro nominale” a quali tipi di armi si riferisce?;È una definizione inesistente;Armi con canna ad anima rigata;Armi con canna ad anima liscia;b;;;
Il “calibro reale” a quali tipi di armi si riferisce?;È una definizione inesistente;Armi con canna ad anima rigata;Armi con canna ad anima liscia;c;;;
Nella     caccia     invernale      agli     acquatici     da appostamento fisso è opportuno utilizzare:;Strozzature   accentuate   e   cartucce con borra contenitore;Strozzature  ridotte e cartucce con borra in feltro;Non vi sono particolari prescrizioni;a;;;
Nelle    caccie    collettive    al    cinghiale,    cosa    è opportuno indossare?;Gilet  o  cappello  o  fascia  ad  alta visibilità per motivi di sicurezza;Indumenti molto mimetici per non essere avvistati dal selvatico;Indumenti   pesanti   perché   sono   caccie invernali;a;;;
;;;;;;;
Domanda;RispostaA;RispostaB;RispostaC;Risposta Esatta;;;
Che cos’è l’emorragia?;Fuoriuscita di sangue in abbondante quantità da una ferita;Violente scariche diarroiche;Perdita di urina;a;;;
L’emorragia può essere:;Solo arteriosa;Solo venosa;Arteriosa e venosa;c;;;
L’emorragia arteriosa si distingue:;Perché è di breve durata;Perché  il  sangue  è  di  colore  rosso vivo e a getto pulsante;Perché il sangue è di colore scuro;b;;;
Quanti sono i tipi di emorragia?;Un solo tipo (esterna);Due tipi (esterna ed interna);Un solo tipo (interna);b;;;
Che cosa si deve fare in presenza di un’emorragia esterna?;Stendere  l’infortunato  e  coprire  le ferite;Stendere l’infortunato e farlo bere;Mettere un laccio emostatico;c;;;
Che cosa è più opportuno usare per bloccare una emorragia senza disporre di laccio emostatico?;Una cintura;Un maglione;Una calza di nylon;a;;;
Dove si deve mettere il laccio emostatico?;Direttamente sulle ferite;Deve    essere    messo    alla    radice dell’arto interessato;Nella parte più vicina al cuore;b;;;
Che cos’è la ferita?;Una puntura d’insetto;Una sudorazione abbondante;L’interruzione della continuità della cute;c;;;
Domanda;RispostaA;RispostaB;RispostaC;Risposta Esatta;;;
Come si cura una ferita?;Occorre    lavare    abbondantemente con acqua e soluzioni alcaline;Aspettare che il sangue si arresti da solo;Praticare una puntura contro il dolore;a;;;
A che cosa è dovuta l’asfissia?;Al freddo intenso;Ad eccessiva attività sportiva;Ad insufficiente apporto di ossigeno ai tessuti;c;;;
Che cos’è l’arresto cardiaco?;L’arresto della motilità;L’arresto del cuore con arresto della circolazione e del respiro;La perdita temporanea di coscienza;b;;;
Quali sono le cause dell’arresto cardiaco?;Un eccessivo sforzo;Disturbi digestivi;Folgorazione, infarto, asfissia, gravi disturbi di cuore;c;;;
Come si riconosce un arresto cardiaco?;Dalla  perdita  di  coscienza,  pallore della cute, labbra e unghie cianotiche;Da uno stato euforico;Dalla mancanza di lucidità e orientamento;a;;;
Cos’è l’infarto del miocardio?;Spostamento del cuore;Rottura di una parte del cuore causato dalla chiusura di una arteria coronarica che porta ossigeno al cuore;Un corpo estraneo che colpisce il cuore;b;;;
Come si riconosce un infarto cardiaco?;Da un forte dolore muscolare;Da un forte dolore di testa;Dal dolore al torace molto forte trasmesso anche allo sterno, al braccio sinistro e/o allo stomaco;c;;;
Come  ci  si  deve  comportare  in  presenza  di  un infarto cardiaco?;Invitare il soggetto alla calma;Rassicurare  il  soggetto  ed  evitargli ogni minimo sforzo;Invitare   il   soggetto   ad   assumere   piccole quantità di acqua fresca;b;;;
Quali sono i fattori di rischio di un infarto?;Grave depressione;Grave denutrizione;Fumo,   alimentazione   ricca   di   grassi,   uso abbondante di sostanza alcooliche, stress;c;;;
Che cosa si deve fare quando una persona sviene?;Mettere la persona seduta e svestirla;Mettere  la  persona  distesa  con  le gambe in alto;Caricarla sulle spalle e trasportarla alla casa più vicina;b;;;
Che cos’è una frattura?;È la rottura di un osso;È il cosiddetto colpo della strega;È la mancanza di un osso;a;;;
Come si riconosce una frattura?;Dal dolore, dalla deformità della parte colpita e da impotenza funzionale;Da  un’eccessiva  sudorazione  e  dal dolore;Dalla comparsa di febbre;a;;;
Come si aiuta un soggetto fratturato?;Deve   essere   aiutato   a   rialzarsi   e riacquistare i movimenti;Si devono immobilizzare le fratture e trasportare la persona al più vicino ospedale;Bisogna aspettare che gli passi il dolore;b;;;
Dopo una distorsione che cosa bisogna fare?;Impacchi freddi e una fasciatura non stretta;Mettere il laccio emostatico;Fare     compressione     diretta     e     mettere fasciature strette;a;;;
Come si può capire se una caduta ha provocato la frattura della colonna vertebrale?;Dai dolori in tutte le parti del corpo;Dal formicolio alle braccia e/o alle gambe o dall’impossibilità a muovere braccia e gambe;Dalla comparsa improvvisa di febbre;b;;;
È  consigliabile  trasportare  da  soli  un  fratturato vertebrale?;Sì;No;Dipende da quale vertebra è fratturata;b;;;
Domanda;RispostaA;RispostaB;RispostaC;Risposta Esatta;;;
Che cos’è un trauma cranico?;Un violento colpo al capo con lesione ossea del cranio;Uno stato di stress psicologico;Uno stato di euforia e di ebbrezza;a;;;
Come si fa a riconoscere se una persona ha subito un trauma cranico?;Dalla   perdita   di   movimento   delle braccia e delle gambe;Dalla  perdita  di  coscienza,  cefalea, vomito e vertigini;Dalla perdita di movimento della sola testa;b;;;
Che   cosa   occorre   fare   quando   una   persona presenta un trauma cranico?;Si deve mettere la persona sdraiata e aspettare che arrivino i soccorsi;Si deve mettere la persona sdraiata ruotata sul fianco e chiamare urgentemente soccorso;La si deve caricare a spalle in cerca di soccorso;b;;;
Come si manifesta il congelamento?;Da  lesioni  locali  per  l’esposizione  a freddo intenso;Da lesioni locali conseguenti a forti variazioni di temperatura;Dal rossore del viso;a;;;
Che cos’è l’assideramento?;È  la  conseguenza  di  una  mancata ossigenazione;È  la  conseguenza  di  una  mancata alimentazione;È il prodotto di lesioni generali determinate da una esposizione totale a basse temperature;c;;;
Quali sono le parti più colpite da congelamento?;Le mani;I polmoni;Le estremità degli arti, naso e orecchio;c;;;
Quali sono i sintomi di assideramento?;Apatia, difficoltà del linguaggio, del movimento, pallore, difficoltà respiratorie;Euforia;Lentezza nei movimenti ed euforia;a;;;
Che cos’è il colpo di calore?;È  una  lesione  da  contatto  con  un materiale troppo caldo;È   il  calore   che   si   sviluppa   dopo un’abbondante libagione;Eccessivo aumento della temperatura corporea conseguente a una lunga esposizione ad alta temperatura;c;;;
Quali sono i sintomi di un colpo di calore?;Cute calda e secca, assenza di sudorazione, aumento del battito cardiaco, fastidio alla luce;Assenza di movimento e ansia;Stato di eccitazione;a;;;
Come  si  deve  intervenire  quando  un  soggetto presenta un colpo di calore?;Gli si deve togliere gli indumenti e lo si deve mettere in un luogo fresco facendogli bere solo acqua fresca;Lo si deve coprire con indumenti di lana;Lo si deve bagnare con acqua fresca;a;;;
Come si riconosce un morso di vipera?;Si riconosce da 1 solo piccolo foro;Si  riconosce  da  3  fori  disposti  a triangolo;Si riconosce da 2 piccoli fori distanti 1 cm uno dall’altro;c;;;
Nei casi di morsi di vipera è necessario:;Somministrare         sempre         siero antiofidico;Mettere il laccio emostatico a monte del morso;Effettuare un’incisione cutanea nella sede del morso;b;;;
Quali sono, tra gli altri, gli accorgimenti per evitare il morso di vipera?;Scegliere sentieri e  luoghi frequentati, calzare scarponi e calze pesanti, battere il suolo con un bastone;Indossare   scarpe   da   ginnastica   e pantaloni leggeri;Camminare     tranquillamente     su     sentieri frequentati senza fare eccessivo rumore;a;;;
Che cos’e lo shock anafilattico?;Uno  shock  derivante  da  un  forte  e improvviso spavento;Uno shock paralizzante derivante da un trauma;Una    grave    reazione    allergica    a    rapida comparsa che può provocare il decesso;c;;;
Tra le principali cause di shock anafilattico, vi sono:;Punture di ragni, api e vespe;Inalazione di pollini;Scariche  adrenaliniche  derivanti  da  un  forte trauma;a;;;
Domanda;RispostaA;RispostaB;RispostaC;Risposta Esatta;;;
Cosa occorre fare con un soggetto colpito da shock anafilattico?;Porlo supino all’ombra con le gambe leggermente sollevate, confortandolo e rassicurandolo sull’arrivo dei soccorsi, frattanto allertati;Farlo        sedere        all’ombra        e somministrargli acqua fresca;Fargli impacchi freschi alle parti arrossate e gonfie;a;;;
;;;;;;;
Domanda;RispostaA;RispostaB;RispostaC;Risposta Esatta;;;
A chi deve essere inoltrata domanda per sostenere l’esame di abilitazione alla caccia?;Alla Questura;Alla Regione;Alle associazioni venatorie;b;;;
In  caso  di  revoca  della  licenza  di  caccia,  cosa occorre fare per riottenerla?;Ripetere l’esame di abilitazione;Rivolgere domanda alla Regione;Rivolgere domanda al Prefetto;a;;;
Durante il primo anno di caccia cosa è tenuto a fare il cacciatore?;Deve farsi accompagnare dal tutore;Deve farsi accompagnare da un cacciatore che abbia la licenza da almeno tre anni;Deve   farsi   accompagnare   da   una   guardia venatoria;b;;;
Che validità ha la licenza di caccia?;Tre anni;Sei anni;Otto anni;b;;;
Quali documenti deve portare con sé il cacciatore durante l’esercizio venatorio?;Solo la licenza di caccia;Licenza di caccia, tesserino regionale e assicurazione;Solo il tesserino regionale;b;;;
A  quale  età  minima  è  consentito  esercitare  la caccia?;21 anni;16 anni;18 anni;c;;;
Da quanti anni, come minimo, deve avere la licenza il cacciatore che accompagna chi è alla prima licenza?;2 anni;3 anni;5 anni;b;;;
Qual   è   la   validità   della   tassa   di   concessione governativa per il porto di fucile uso caccia?;Una stagione venatoria;365 giorni dalla data del rilascio della licenza;6 anni dalla data del primo versamento;b;;;
Il  cacciatore  cosa  deve  annotare,  fra  l’altro,  sul tesserino venatorio?;I capi abbattuti;L’ora di inizio e termine della caccia;La regione nella quale si esercita la caccia;a;;;
Il tesserino venatorio ha validità nazionale?;Sì;No,    vale    solo    nella   regione    di residenza;No, vale solo nella provincia di residenza;a;;;
Chi rilascia il tesserino venatorio?;La Regione;La Prefettura;La Questura;a;;;
A fine stagione venatoria il tesserino venatorio:;Può essere distrutto;Deve    essere    conservato    per    la stagione successiva;Va   riconsegnato   alla   Regione   che   lo   ha rilasciato;c;;;
Come viene considerata dalla legge dello Stato la fauna selvatica?;Patrimonio indisponibile dello Stato;Proprietà del conduttore  del fondo dove si trova;Cosa di nessuno;a;;;
Quale   ente   ha   competenza   amministrativa   in materia di caccia?;Il Comune;La Regione;La Comunità montana;b;;;
Domanda;RispostaA;RispostaB;RispostaC;Risposta Esatta;;;
I proventi derivanti dalle sanzioni amministrative in materia di caccia da chi vengono incamerati?;Dal Ministero delle Politiche Agricole;Dalla Regione;Dai Comuni;b;;;
Cosa si intende per controllo della fauna selvatica?;Effettuare censimenti  e  conteggi delle popolazioni selvatiche a fini statistici;Effettuare interventi di riduzione delle popolazioni selvatiche tramite catture e/o abbattimenti;Effettuare       un’assidua       vigilanza       delle popolazioni selvatiche;b;;;
L’uccisione   casuale   di   una   lepre   durante   una falciatura è considerata esercizio di caccia?;No;Sì;Solo in periodo di caccia consentita;a;;;
A chi appartiene la fauna selvatica legittimamente abbattuta?;A colui che l’ha abbattuta;Al proprietario del cane;Al proprietario del fondo;a;;;
Quali dei seguenti animali è da considerarsi fauna selvatica?;Coniglio selvatico;Ratto;Arvicola;a;;;
Chi è proprietario della fauna  selvatica rinvenuta morta?;Chi la rinviene;Il Comune sul cui territorio è stata rinvenuta;Lo Stato;c;;;
Chi emana il calendario venatorio integrativo per la zona faunistica delle Alpi?;Il CAC;La Regione;La Comunità montana;b;;;
Chi approva le disposizioni integrative al calendario venatorio regionale?;La Giunta regionale;Il Consiglio regionale;Il coordinamento degli ATC e dei CAC;a;;;
Chi rilascia il porto di fucile a uso caccia?;La Regione;La Prefettura;La Questura;c;;;
La fauna selvatica italiana è tutelata nell’interesse di chi?;Dei cacciatori;Degli agricoltori;Di tutti i cittadini;c;;;
A chi appartiene la fauna selvatica?;Allo Stato;Alla Regione;A nessuno;a;;;
Per   superficie   agro-silvo-pastorale   ai   fini   della caccia programmata si deve intendere:;Ogni  parte  del  territorio  in  cui può vivere la fauna selvatica;Il territorio utilizzato a scopo agricolo e forestale;Le zone adibite al pascolo del bestiame;a;;;
Per ambito territoriale di caccia s’intende:;Il territorio del comune di residenza del cacciatore;Il     terreno     in     cui     si     esercita solitamente la caccia;La   zona  delimitata   sul   territorio   cui   si  è ammessi a praticare la caccia programmata;c;;;
Per caccia programmata s’intende:;L’esercizio venatorio che ogni cacciatore programma all’inizio della stagione;La caccia esercitata insieme ad altri cacciatori;Il  prelievo  venatorio  in  un  ambito  o  in  un comprensorio;c;;;
Come viene considerata dalla legge la caccia da appostamento temporaneo rispetto all’opzione in via esclusiva?;Come   la   caccia   da   appostamento fisso;Come la caccia vagante;È un’opzione a se stante;b;;;
Tra  le  forme  di  caccia  in  via  esclusiva  si  può scegliere:;Caccia da appostamento fisso;Caccia            da            appostamento temporaneo;Caccia di selezione agli ungulati;a;;;
La caccia programmata è estesa:;A tutto il territorio nazionale;Solo alla regione Lombardia;Solo alla zona Alpi;a;;;
A  chi  è  consentito  l’accesso  nelle  zone  a  caccia programmata?;Solo ai cacciatori ammessi;Solo   ai   cacciatori   residenti   nella regione;Solo ai cacciatori residenti nella zona;a;;;
Domanda;RispostaA;RispostaB;RispostaC;Risposta Esatta;;;
Che cosa si intende per pianificazione territoriale in materia di caccia?;La caccia esercitata in pianura;Programmare   un  diversificato  uso del territorio in relazione alla caccia;Individuare le sole zone a divieto di caccia;b;;;
Chi   suddivide   il   territorio   regionale   in   Ambiti territoriali e in Comprensori alpini di caccia?;Il Ministero delle Politiche agricole;La Regione;Il Ministero dell’Ambiente;b;;;
Che cosa sono i Comprensori alpini di caccia?;Zone alpine a caccia programmata;Istituti di caccia privati;Zone a caccia vietata;a;;;
Per piani di abbattimento si intende:;Il  prelievo   complessivo  di   capi  di avifauna migratoria consentita;Il prelievo programmato delle specie di fauna stanziale in un ambito o in un comprensorio alpino;Gli  interventi  del  servizio  di  vigilanza  per  il controllo dei predatori;b;;;
Per  destinazione  differenziata del territorio a fini venatori si intende:;La distinzione territoriale tra zona di pianura e zona Alpi;L’utilizzo  del  territorio  ai  fini  della pianificazione faunistico-venatoria;La caccia di specializzazione;b;;;
Nei comitati di gestione degli ambiti territoriali e dei comprensori alpini di caccia, sono presenti fra gli altri:;I rappresentanti delle organizzazioni agricole;I rappresentanti delle organizzazioni sindacali;I     rappresentanti     delle     associazioni     di volontariato sociale;a;;;
Quale   delle   seguenti   specie   è   particolarmente protetta?;Il riccio;Il camoscio alpino;L’aquila reale;c;;;
Quale   delle   seguenti   specie   è   particolarmente protetta?;Il fenicottero;L’oca selvatica;Il germano reale;a;;;
Quale   delle   seguenti   specie   è   particolarmente protetta?;Il colombaccio;La starna;Il cigno reale;c;;;
Quale   delle   seguenti   specie   è   particolarmente protetta?;La volpe;Il capriolo;La lontra;c;;;
Quale delle seguenti specie è vietato abbattere?;La quaglia;La starna;Il pettirosso;c;;;
Quale delle seguenti specie è vietato abbattere?;La pernice rossa;Il gallo cedrone;Il gallo forcello;b;;;
Quale delle seguenti specie è vietato abbattere?;Il riccio;La lepre;Il cinghiale;a;;;
Quale delle seguenti specie è vietato abbattere?;Il germano reale;La cesena;La cincia mora;c;;;
Quale delle seguenti specie è vietato abbattere?;La folaga;La balia nera;La beccaccia;b;;;
Quale delle seguenti specie è vietato abbattere?;Il gatto selvatico;Il coniglio selvatico;La lepre bianca;a;;;
