Column1;Column2;Column3;Column4;Column5;Column6;Column7;Column8
La variazione dell’elenco delle specie cacciabili può essere disposta:;Dal Presidente della Repubblica;Dal Presidente della Giunta regionale;Dal Presidente del Consiglio dei Ministri;c;;;
L’art. 842 del codice civile consente:;L’accesso di tutti  i cittadini  ai fondi altrui;L’accesso   ai   fondi   altrui   solo   dei cacciatori che non utilizzino cani;L’accesso dei cacciatori ai fondi altrui purché non si provochino danni alle colture;c;;;
Le     associazioni    venatorie     riconosciute    sono sottoposte alla vigilanza:;Della  Presidenza  del   Consiglio  dei ministri;Del Ministero delle politiche agricole;dell’ISPRA;b;;;
In  quale  di  questi  casi,  se  recidivi,  vi  è  anche l’esclusione definitiva della licenza di caccia?;Caccia di martedì e di venerdì;Abbattimento e cattura di fauna selvatica in modo diverso da quello consentito;Esercizio  della  caccia  in  periodo  di  divieto generale;c;;;
In   quale   di   questi   casi   è   previsto   l’arresto   o l’ammenda?;Caccia  sparando   da   una   barca   in movimento;Trasporto di armi da caccia scariche in centri abitati;Caccia alla posta alla beccaccia;a;;;
In   quale   di   questi   casi   si   applica   l’arresto   e l’ammenda?;Caccia  in  zona  di  ripopolamento  e cattura;Trasporto  di  armi  scariche  non  in custodia su autoveicoli;Commercio    di    allodole    quando    ne    è consentita la caccia;a;;;
In quale di questi casi, se recidivi, scatta anche la sospensione per un anno della licenza?;Caccia senza annotare la giornata sul tesserino venatorio;Abbattimento   fauna   stanziale   da appostamento fisso;Caccia in forma diversa da quella prescelta;c;;;
In  quale  di  questi  casi,  se  recidivi,  vi  è  anche l’esclusione definitiva della licenza?;Abbattimento di una cicogna;Caccia senza assicurazione;Caccia a meno di cento metri da una casa;a;;;
In  quale  di  questi  casi,  se  recidivi,  vi  è  anche  la sospensione per un anno della licenza?;Caccia in azienda faunistico-venatoria senza permesso;Caccia  col  segugio  agli  ungulati  in zona Alpi;Caccia all’aspetto alla beccaccia;a;;;
In  quale  di  questi  casi,  se  recidivi,  vi  è  anche  la sospensione della licenza?;Caccia        in        colture        agricole specializzate;Caccia    con    civetta    viva    come richiamo;Caccia con richiamo a bocca;b;;;
Che cosa comporta la cattura ripetuta di volatili con mezzi diversi da quelli previsti dalla legge?;La  revoca  e   l’esclusione  definitiva della licenza;Un’ammenda e la sospensione della licenza;La sospensione della licenza;b;;;
Che cosa comporta cacciare senza aver pagato le tasse di concessione?;L’esclusione definitiva della licenza;La sospensione della licenza;Una sanzione amministrativa;c;;;
Che   cosa   comporta   cacciare   in   recidiva   senza assicurazione?;L’esclusione definitiva della licenza;La revoca della licenza per dieci anni;Una sanzione amministrativa e la sospensione della licenza per un anno;c;;;
Che  cosa  comporta  l’abbattimento  di  un  cigno reale?;L’arresto     o     un’ammenda     e     la sospensione della licenza;Una sanzione amministrativa;La revoca della licenza;a;;;
Che    cosa    comporta    l’abbattimento    di    uno stambecco?;L’esclusione  definitiva della licenza di caccia;L’arresto e l’ammenda;Nessuna    conseguenza    in    quanto    specie cacciabile;b;;;
Che cosa comporta l’abbattimento di una gru?;La  revoca  e   l’esclusione  definitiva della licenza;L’arresto     o     l’ammenda     e     la sospensione della licenza;Una sanzione amministrativa;b;;;
Che cosa comporta l’abbattimento di una cicogna?;L’esclusione definitiva della licenza;Una sanzione amministrativa;L’arresto o l’ammenda e la sospensione della licenza;c;;;
Domanda;RispostaA;RispostaB;RispostaC;Risposta Esatta;;;
Che  cosa  comporta  l’abbattimento  di  un  gallo forcello al di fuori della zona faunistica delle Alpi?;La sospensione della licenza;Una sanzione amministrativa;La revoca della licenza;b;;;
Che  cosa  comporta  l’abbattimento  di  un  gallo cedrone al di fuori della zona faunistica delle Alpi?;Un’ammenda e la sospensione della licenza in recidiva;Una sanzione amministrativa;La revoca della licenza;a;;;
Che    cosa    comporta    cacciare    in    un’azienda faunistico-venatoria senza permesso?;La sospensione della licenza;Una  sanzione  amministrativa  e  la sospensione della licenza in recidiva;La revoca della licenza;b;;;
Che  cosa  comporta  cacciare  in  un’azienda  agri- turistico venatoria senza permesso?;La sospensione della licenza;Una sanzione amministrativa;La revoca della licenza;b;;;
Che cosa comporta, fatte salve le eccezioni di legge, cacciare in un ATC senza essere iscritti?;La sospensione della licenza;Una  sanzione  amministrativa  e  la sospensione della licenza in recidiva;La revoca della licenza;b;;;
Che cosa comporta, fatte salve le eccezioni di legge, cacciare in un CAC senza essere iscritti?;La sospensione della licenza;Una  sanzione  amministrativa  e  la sospensione della licenza in recidiva;La revoca della licenza;b;;;
Che cosa comporta l’abbattimento di un cinghiale di età inferiore a 1 anno?;Nessuna sanzione;La revoca della licenza;Una sanzione amministrativa;a;;;
Che  sanzione è  prevista per  chi non  effettua sul tesserino venatorio le prescritte annotazioni?;Una sanzione amministrativa;La revoca della licenza;La sospensione della licenza;a;;;
Che sanzione è prevista per chi, non recidivo, caccia specie non consentite?;Un’ammenda;La revoca della licenza;La sospensione della licenza;a;;;
Che  sanzione  è  prevista  per  chi  abbatte  fauna selvatica cacciabile oltre il numero consentito?;Una sanzione amministrativa;La revoca della licenza;La sospensione della licenza;a;;;
Che  cosa  comporta  l’abbattimento  di  un  airone bianco maggiore?;Una sanzione amministrativa;Un’ammenda e la sospensione della licenza in recidiva;La sospensione della licenza;b;;;
In quale di questi casi la licenza è revocata?;Per    aver    abbattuto    un    chiurlo maggiore;Per  aver  dimenticato  di  portare  la licenza con sé;Per aver esercitato l’uccellagione;c;;;
Quale sanzione è prevista per chi porta o trasporta fucili non in custodia quando la caccia non è consentita?;Una sanzione amministrativa;La revoca della licenza;La sospensione della licenza per dieci anni;a;;;
Chi  caccia  in  un’oasi  di  protezione  è  soggetto  a quale sanzione?;A un’ammenda;All’arresto;All’arresto e al pagamento di un’ammenda;c;;;
Quale  sanzione  comporta  l’abbattimento  di  una pispola?;Nessuna;Una sanzione penale;Una sanzione amministrativa;b;;;
In quale di questi casi, se recidivi, vi è la revoca della licenza?;Caccia in una riserva naturale;Caccia   agli   ungulati   con   terreno coperto di neve;Trasporto  d’armi  quando  la  caccia  non  è consentita;a;;;
Domanda;RispostaA;RispostaB;RispostaC;Risposta Esatta;;;
In quale di questi casi vi è la revoca della licenza?;Esercizio dell’uccellagione;Superamento  del  limite  giornaliero di fauna stanziale;Caccia senza accompagnatore;a;;;
In quale di questi casi, se recidivi, vi è la revoca della licenza?;Caccia in giardini pubblici;Caccia   a   rastrello   in   più   di   tre persone;Caccia da appostamento alla beccaccia;a;;;
In quale dei seguenti casi vi è anche la sospensione della licenza?;Caccia senza versamento delle tasse;Caccia da natante;Superamento  del  limite  giornaliero  di  capi consentito;b;;;
In quale dei seguenti casi, in recidiva, vi è la revoca della licenza?;Caccia  in  zona  di  ripopolamento  e cattura;Abbattimento   fauna   stanziale   da appostamento fisso;Superamento  delle  giornate   settimanali  di caccia consentite;a;;;
In   quale   dei   seguenti   casi,   se   recidivi,   vi   è l’esclusione definitiva della licenza?;Caccia in periodo di divieto generale;Caccia senza assicurazione;Caccia  a  meno  di  cinquanta  metri  da  una ferrovia;a;;;
In quale dei seguenti casi, se recidivi, vi è la revoca della licenza?;Trasporto di armi su autovettura di armi scariche ma non in custodia;Caccia senza versamento della tassa regionale;Caccia in una riserva naturale regionale;c;;;
In   quale   dei   seguenti   casi,   se   recidivi,   vi   è l’esclusione definitiva della licenza?;Caccia allo stambecco;Commercio  di  uccelli  morti  quali  i tordi;Allevamento di lepri senza autorizzazione;a;;;
In quale dei seguenti casi, se recidivi, vi è la revoca della licenza?;Caccia in un parco nazionale;Allevamento     di     alaudidi     senza autorizzazione;Uso di fauna morta non di allevamento per manifestazioni gastronomiche;a;;;
Che  cosa  comporta  l’abbattimento  di  un  airone guardabuoi?;Un’ammenda e la sospensione della licenza in recidiva;Una sanzione amministrativa;La revoca della licenza;a;;;
Quale sanzione è prevista per chi caccia con armi ad aria compressa?;Un’ammenda;La revoca della licenza;Una sanzione amministrativa;a;;;
Quale sanzione è prevista per chi caccia con l’uso di un registratore come richiamo acustico?;Un’ammenda    e    la    confisca    del registratore;Una sanzione amministrativa;La revoca, in recidiva, della licenza;a;;;
In quale di questi casi, se recidivi, vi è l’esclusione definitiva della licenza?;Caccia   agli   acquatici   nel   mese   di marzo;Caccia       da       appostamento       al beccaccino;Caccia da veicoli;a;;;
In quale di questi casi, se recidivi, vi è la revoca e il divieto di rilascio per dieci anni della licenza?;Caccia su terreno coperto di neve;Caccia da natante in movimento;Caccia in valli da pesca regolarmente tabellate;b;;;
In quale di questi casi vi è anche l’arresto?;Caccia nelle riserve naturali;Caccia senza assicurazione;Introduzione    illegale    di    fauna    selvatica dall’estero;a;;;
In   quale   di   questi   casi   è   previsto   l’arresto   e l’ammenda?;Caccia in giardini urbani;Caccia a meno di cento metri da una casa;Rimozione di legittime tabelle di divieto;a;;;
In   quale   di   questi   casi   è   previsto   l’arresto   o l’ammenda?;Caccia in orari non consentiti;Caccia da appostamento fisso senza autorizzazione;Caccia da veicoli;c;;;
In quale di questi casi può scattare anche l’arresto?;Caccia al fagiano nel mese di maggio;Caccia   a   rastrello   in   più   di   tre persone;Appostamento fisso abusivo;a;;;
Che cosa comporta l’introduzione illegale di fauna selvatica dall’estero?;Una sanzione amministrativa;La revoca della licenza;La sospensione della licenza;a;;;
Domanda;RispostaA;RispostaB;RispostaC;Risposta Esatta;;;
Il coordinamento delle guardie venatorie volontarie spetta:;Alla Prefettura;Al corpo di Polizia provinciale;All’Arma dei carabinieri;b;;;
Chi    rilascia    il    decreto    di    guardia    venatoria volontaria?;La Regione;La Provincia;Il Prefetto;b;;;
Che  qualifica  hanno  gli  agenti  di  vigilanza  ittico- venatoria dipendenti dalle Province?;Sono agenti volontari;Sono pubblici ufficiali;Sono agenti di polizia giudiziaria e di pubblica sicurezza;c;;;
Dove possono esercitare la caccia gli agenti della Polizia provinciale?;Nel territorio della propria provincia;Nel     territorio     del     comune     di residenza;Nel territorio di un’altra provincia;c;;;
È sequestrabile il cane?;Sì,  se  produce  effettivi  danni  alla fauna;Sì, se danneggia i terreni coltivati;No, mai;c;;;
Gli    agenti    della    Polizia    provinciale    devono sequestrare l’arma quando il cacciatore:;Ha abbattuto un capriolo;Ha abbattuto un camoscio;Ha abbattuto uno stambecco;c;;;
Quando gli agenti della Polizia provinciale procedono al sequestro della fauna selvatica morta?;Non  possono  mai  procedere  a  tale sequestro;Procedono sempre;Quando la stessa costituisce il prodotto della violazione o il corpo di reato;c;;;
La  qualifica  di  guardia  venatoria  volontaria  può essere concessa:;A    tutti    coloro    che    ne    facciano richiesta;Solo  a  chi  abbia  superato  apposito esame di idoneità;Solo a chi si dichiara disponibile a collaborare con la Polizia provinciale;b;;;
Gli   agenti   che   esercitano   funzioni   di   polizia giudiziaria possono procedere:;Al sequestro del cane;Al    sequestro    dei    richiami    vivi autorizzati;Al sequestro dei capi abbattuti in tutti i casi previsti dalla legge;c;;;
Gli agenti della Polizia provinciale possono procedere alla perquisizione dell’automobile di un cacciatore?;Mai;Sì, nel caso di fondato sospetto o di flagranza del reato;Sì,   in   caso   di   infrazioni   punite   con   una sanzione amministrativa;b;;;
Le    infrazioni    possono    essere    sanate    in    via amministrativa pagando una somma pari a:;Doppio   del   minimo   o   terzo   del massimo;Triplo del minimo;Metà del massimo;a;;;
Nei siti di Natura 2000 si può esercitare la caccia?;Sì,   solo   sulla   base   del  calendario venatorio regionale;No;Sì,    sulla    base    di    limitazioni    aggiuntive specifiche;c;;;
Chi  ha  introdotto  le  misure  minime  uniformi  di conservazione nei siti di Natura 2000?;Il Ministro delle Politiche Agricole;Il Presidente del Consiglio;Il  Ministro  dell’Ambiente  e  della  Tutela  del Territorio e del Mare;c;;;
Nelle ZPS quale delle seguenti specie selvatiche non può mai essere cacciata?;La pernice rossa;La pernice bianca;La coturnice delle Alpi;b;;;
Cosa significa l’acronimo “ZPS”?;Zona di Passaggio Speciale;Zona di Protezione Speciale;Zona di Protezione della Selvaggina;b;;;
Nelle ZPS quale delle seguenti specie selvatiche non può mai essere cacciata?;Il moriglione;Il codone;La moretta;c;;;
Per  quante  giornate  settimanali  si  può  cacciare nelle ZPS nel mese di gennaio?;Tre;Due;Una;b;;;
Nelle  ZPS  è  consentito  cacciare  gli  ungulati  in selezione?;Sì;No;Solo il cinghiale;a;;;
Il regime di protezione della fauna selvatica è più rigido in una ZPS o in una riserva naturale?;In una ZPS;È lo stesso;In una riserva naturale;c;;;
Domanda;RispostaA;RispostaB;RispostaC;Risposta Esatta;;;
In Lombardia sono state istituite ZPS?;Sì, solo in montagna;Sì, ovunque vi siano ambienti ritenuti meritevoli di tale livello di tutela;Sì, solo lungo i fiumi;b;;;
Nelle ZPS quale delle seguenti specie selvatiche non può mai essere cacciata?;Il beccaccino;Il combattente;Il frullino;b;;;
Nelle   ZPS   le   giornate   settimanali   di   caccia   in gennaio sono fisse?;No;Sì e vengono fissate dalla Regione;Sì     e     vengono dell’Ambiente;b;;;
Nelle ZPS caratterizzate da zone umide, qual’è l’unica specie di anatide che può essere cacciata in data antecedente al 1° ottobre?;L’alzavola;La marzaiola;Il germano reale;c;;;
;;;;;;;
Domanda;RispostaA;RispostaB;RispostaC;Risposta Esatta;;;
Perché alcune specie di fauna selvatica si dicono insettivore?;Perché si cibano anche di insetti;Perché si cibano prevalentemente di insetti;Perché hanno le ali come gli insetti;b;;;
Perché nella zona delle Alpi i periodi di caccia sono più limitati?;Perché nevica molto;Perché la tipica avifauna alpina cova in anticipo;Perché     la     fauna     stanziale     alpina     va maggiormente tutelata;c;;;
Che cos’è l’ecologia?;La      scienza      che      tratta      il comportamento degli animali;La scienza che studia le relazioni tra gli esseri viventi e l’ambiente in cui vivono;La   scienza   che   studia   il   fenomeno   delle migrazioni;b;;;
La  meccanizzazione  agricola  giova  o  nuoce  alla fauna selvatica?;Giova;Nuoce;È indifferente;b;;;
Che cos’è l’etologia?;La       scienza       che       studia       il comportamento degli animali;La   scienza   che   studia   l’etica   in relazione agli animali;La   scienza   che   studia   il   fenomeno   delle migrazioni;a;;;
La fauna selvatica può vivere indifferentemente in qualsiasi ambiente?;Sì;No, ciascuna specie o gruppo di specie necessita di un suo ambiente particolare;Non  ha  alcuna  importanza  perché  si  adatta ovunque;b;;;
Quali siepi sono più utili all’avifauna selvatica?;Quelle rade e ben potate;Quelle non potate e ricche di bacche;Quelle fitte e impenetrabili;b;;;
Se stai fumando in auto cosa ne fai del mozzicone accesso?;Lo getti dal finestrino;Lo spegni nel posacenere;Lo   spegni   nel   posacenere   e   lo   getti   dal finestrino;b;;;
La risaia è una coltivazione in atto?;Sì, dalla semina al raccolto;Mai;Solo poco prima del raccolto;a;;;
La marcita è una coltivazione in atto?;Sempre;Mai;Solo in parte;a;;;
Il vivaio è una coltivazione in atto?;Sempre;No, mai;Solo fino a un anno dall’impianto;a;;;
Quando il vigneto è in attualità di coltivazione?;Durante la potatura;Durante l’aratura;Fino a maturazione e raccolta dell’uva;c;;;
Cos’è un vivaio?;Una coltura specializzata;Un bosco artificiale;Una coltura annuale;a;;;
Che cosa è una palude?;Una coltura biennale;Un prato allagato artificialmente;Una zona umida;c;;;
Domanda;RispostaA;RispostaB;RispostaC;Risposta Esatta;;;
Cosa produce la marcita?;Erba;Frumento;Avena;a;;;
È  auspicabile  un  rapporto  di  collaborazione  tra caccia e agricoltura?;No;Sì;Ha poca importanza;b;;;
In quale periodo si raccoglie normalmente il riso?;Luglio/agosto;Settembre/ottobre;Novembre/dicembre;b;;;
In che periodo normalmente si raccolgono le uve nere?;Luglio/agosto;Settembre/ottobre;Novembre/dicembre;b;;;
In  quale  mese  si  inizia  normalmente  la  raccolta delle olive?;Settembre;Novembre;Marzo;b;;;
Quale  delle  seguenti  pratiche  agronomiche  può essere utile per la fauna selvatica?;Il   mantenimento   in   campo   delle stoppie di cereali;Il diserbo meccanico;La potatura delle siepi;a;;;
Quale dei seguenti sistemi può essere adottato per limitare i danni causati dalle macchine agricole alla fauna selvatica?;Usare macchine di grandi dimensioni;Montare  sulla  macchina  sistemi  di allontanamento della fauna;Iniziare i lavori dai bordi dei campi;b;;;
In  un  fondo  chiuso  chi  può  catturare  la  fauna stanziale?;L’ATC;Le associazioni venatorie;La Regione;c;;;
Quando è possibile cacciare in un vivaio?;Con il consenso del proprietario;Solo per addestrare il cane;Mai;c;;;
Se si trova un nido, cosa è corretto fare?;Allontanarsi per non disturbare;Raccoglierlo per esaminarlo;Raccoglierlo per nasconderlo altrove;a;;;
Se nei mesi estivi si trova un cucciolo di capriolo, cosa è corretto fare?;Non toccarlo e allontanarsi subito;Esaminarlo  per  verificare  che  stia bene;Raccoglierlo per portarlo in un luogo nascosto;a;;;
Se un fagiano alzato dal cane si posa in un prato dove l’agricoltore sta tagliando l’erba, come  ci si comporta?;Si richiama il cane andando oltre;Si incita il cane a cercare il fagiano;Si entra nel prato insieme al cane;a;;;
Chi indennizza i danni che il cacciatore può arrecare all’agricoltura?;La Provincia;La Regione;Il cacciatore stesso;c;;;
Chi indennizza agli agricoltori i danni arrecati dalla fauna selvatica nei territori a caccia programmata?;La  Regione  e  in  parte  i  comitati  di gestione di ATC e CAC;Il Comune;I comitati di gestione di ATC e CAC;a;;;
Chi indennizza agli agricoltori i danni arrecati dalla fauna selvatica nelle oasi di protezione e nelle zone di ripopolamento e cattura?;I comitati di gestione di ATC e CAC;La Regione;Il Comune;b;;;
Come si chiama l’effetto provocato nei corsi e specchi d’acqua dai fertilizzanti provenienti da agricoltura e scarichi domestici?;Fermentazione;Eutrofizzazione;Sedimentazione;b;;;
Cosa s’intende per frutti pendenti?;I frutti pressoché maturi;I frutti caduti dagli alberi;Piante da frutto sovraccariche;a;;;
Una foresta di abete bianco e abete rosso è detta:;Foresta di aghifoglie;Foresta di latifoglie;Macchia mediterranea;a;;;
La  realizzazione  di  una  pista  da  sci  in  montagna cosa comporta per la tipica fauna alpina?;Facilita lo spostamento tra i boschi;Introduce nuove fonti di disturbo;Nessuna conseguenza;b;;;
Domanda;RispostaA;RispostaB;RispostaC;Risposta Esatta;;;
Qual è il maggiore impatto della rete  viaria sulla fauna selvatica?;Frammenta  il  territorio  e  introduce barriere fisiche ai suoi spostamenti;La fa allontanare per l’inquinamento acustico;La fa allontanare per l’inquinamento luminoso nelle ore notturne;a;;;
Che cosa riguarda l’inquinamento idrico?;L’acqua;L’aria;L’acqua e l’aria;a;;;
L’inquinamento atmosferico è più avvertito:;Quando spirano forti venti da nord;Quando  ci  sono  nebbia  e  calma  di vento;Quando piove in maniera moderata o forte;b;;;
Gli  alberi  morti  e  secchi  sono  utili  o  inutili  nel bosco?;Sono  inutili  perché  non  producono più ossigeno;Sono  inutili  e  pericolosi  in  quanto esca per incendi;Possono  essere  utili  per  l’alimentazione  di certe specie di uccelli come i picchi;c;;;
Dopo quanti anni dall’impianto di solito si tagliano i pioppeti?;4 anni;6 anni;10 anni;c;;;
Quale delle seguenti specie di avifauna fa più danni ai frutteti?;Lo storno;Il picchio verde;Il pettirosso;a;;;
Quali sostanze di sintesi si usano per eliminare le erbe infestanti?;Diserbanti;Anticrittogamici;Insetticidi;a;;;
Che cos’è lo smog?;È una sostanza di laboratorio;È una fitta nebbia naturale;È      una      conseguenza      dell’inquinamento atmosferico;c;;;
Quale   delle   seguenti   essenze   arboree   non   è originaria del nostro paese?;Olmo;Acero campestre;Robinia;c;;;
Che cosa si intende per marcita?;Un prato naturale;Un medicaio;Un prato irrigato artificialmente;c;;;
Che   rapporto   esiste   fra   la   fauna   selvatica   e l’ambiente?;Nessun rapporto particolare;Un rapporto casuale;Un rapporto stretto e diretto;c;;;
Le piante verdi respirano?;Sempre;Solo di notte;Mai;b;;;
Quale delle seguenti specie di uccelli è più dannosa per le colture cerealicole?;La cesena;Il codibugnolo;La cornacchia grigia;c;;;
Cosa sono i cereali autunno-vernini?;Cereali   che   vengono   seminati   in autunno;Cereali   che   vengono   raccolti   in autunno;Cereali che vengono raccolti in inverno;a;;;
Nel  caso  in  cui  andando  a  caccia  si  avvisti  un incendio boschivo, cosa occorre fare?;Telefonare immediatamente al numero di emergenza dei vigili del fuoco;Cercare di spegnere le fiamme;Allontanarsi per non correre rischi inutili;a;;;
Quale dei seguenti terreni può meglio ospitare il beccaccino?;Stoppia di soia;Stoppia di riso;Campo arato;b;;;
Quali delle seguenti colture  sono più  idonee  alla presenza della starna?;Cereali autunno-vernini;Riso;Pascoli alpini;a;;;
La liquidazione dei danni arrecati alle colture agricole dalla fauna selvatica in un’oasi di protezione, da chi viene di norma effettuata?;Dai comitati di gestione degli ATC;Dalla Regione;Dalle associazioni venatorie;b;;;
Quali delle seguenti colture  sono più  idonee  alla presenza della lepre comune?;Erbai e medicai;Cereali autunno-vernini;Soia e mais;a;;;
Domanda;RispostaA;RispostaB;RispostaC;Risposta Esatta;;;
Quando un prato stabile viene considerato coltura in atto?;Sempre;Mai;Solo all’epoca della fienagione;a;;;
Qual  è  stata  in  passato  la  causa  principale  della degradazione di boschi e foreste?;Il pascolo eccessivo;Il vento;Il fuoco;a;;;
Quali sono gli agenti preposti alla sorveglianza del patrimonio boschivo?;Le guardie zoofile;Il   nucleo   forestale   dell’Arma   dei Carabinieri;Le guardie ecologiche volontarie;b;;;
Le mele in quale mese normalmente si raccolgono?;Giugno;Ottobre;Dicembre;b;;;
Gli incendi boschivi cosa comportano nei riguardi della fauna selvatica?;Ne favoriscono l’aumento;Ne provocano la scomparsa;Non hanno alcun impatto;b;;;
In un bacino idrografico una ricca vegetazione che cosa assicura?;Regola     l’assorbimento     dell’acqua piovana;Facilita le piene di fiumi e torrenti;Causa siccità assorbendo tutta l’acqua piovana;a;;;
Quale delle seguenti specie arreca sovente danno all’agricoltura?;Beccaccia;Allodola;Piccione torraiolo;c;;;
In quale mese di semina normalmente il frumento?;Agosto;Ottobre;Dicembre;b;;;
In quale tra le seguenti province è più facile trovare le ultime marcite?;Como;Varese;Lodi;c;;;
Quale conseguenza, tra le altre, ha comportato lo spopolamento delle montagne?;L’aumento delle superfici forestali;L’incremento della coturnice;Il calo delle popolazioni di ungulati;a;;;
Se cacciando si arrecano danni alle colture agricole, come occorre comportarsi?;Allontanarsi      prima      di      essere individuati;Risarcire  i danni al proprietario del fondo;Rivolgersi alla propria associazione venatoria che provvederà al risarcimento;b;;;
Se accade di imbattersi in un rettile, come si deve agire?;Lasciarlo stare;Eliminarlo;Catturarlo vivo;a;;;
Su quale delle seguenti colture può causare danni il germano reale?;Il mais;La soia;Il riso;c;;;
Quando  un  prato  di  erba  medica si  considera in attualità di coltivazione?;Subito dopo lo sfalcio;Quando     l’erba     è     alta     pochi centimetri;Quando l’erba è pronta per lo sfalcio;c;;;
Quale delle seguenti specie arreca sovente danno ai seminativi?;Volpe;Nutria;Faina;b;;;
Si può cacciare in un terreno coltivato a mais da seme?;No;Sì, solo finché è verde;Sì;a;;;
Chi paga i danni arrecati dalla fauna selvatica alle colture in un’oasi di protezione?;La Regione;L’ATC o il CAC;Lo Stato;a;;;
Chi paga i danni arrecati dalla fauna selvatica alle colture in un’area a parco naturale?;L’ATC o il CAC;L’ente gestore dell’area protetta;La Regione;b;;;
Qual è lo scopo principale per cui si costituiscono le oasi di protezione?;Per      proteggere      un      territorio dall’urbanizzazione;Per sfruttare in maniera pianificata le risorse forestali;Per    salvaguardare    la    fauna    selvatica    e favorirne sosta e riproduzione;c;;;
Domanda;RispostaA;RispostaB;RispostaC;Risposta Esatta;;;
Cosa è il riso crodo?;Un’infestante del riso;Una     pregiata     varietà     di     riso piemontese;Una pregiata varietà di riso della Lomellina;a;;;
