Column1;Column2;Column3;Column4;Column5;Column6;Column7;Column8
Domanda;RispostaA;RispostaB;RispostaC;Risposta Esatta;;;
Cosa sono i Fringillidi?;Famiglia      di      uccelli      dell’ordine Passeriformi;Famiglia     di     uccelli     dell’ordine Anseriformi;Famiglia di uccelli dell’ordine Gruiformi;a;;;
Perché taluni uccelli sono insettivori?;Per istinto;Perché necessitano di proteine;Per proteggere l’agricoltura;b;;;
Quale di questi Corvidi ha il piumaggio totalmente nero?;La cornacchia grigia;La gazza;Il corvo;c;;;
Perché solitamente la lepre si alimenta di notte?;Per diminuire il rischio di predazione;Perché  è  infastidita  dalla  luce  del sole;Perché  con la rugiada notturna l’erba è più digeribile;a;;;
Quale di questi uccelli non è migratore?;Il tordo bottaccio;La rondine;La pernice rossa;c;;;
I ripopolamenti con fauna selvatica di provenienza dall’estero quali conseguenze possono portare?;Miglioramento genetico;Inquinamento           genetico           e introduzione di malattie;Non portano particolari conseguenze;b;;;
Quale di questi uccelli è un tetraonide?;L’aquila reale;La coturnice;Il gallo cedrone;c;;;
Quale di questi mammiferi è un cervide?;Il camoscio;Il capriolo;Il muflone;b;;;
Quale  di  questi  Caradriformi  presenta  un  lungo ciuffo di piume sulla nuca?;La beccaccia;La pavoncella;Il beccaccino;b;;;
Quale   di   queste   specie   è   strettamente   legata all’ambiente acquatico?;L’allodola;La peppola;La folaga;c;;;
Quale delle seguenti specie di uccelli è sedentaria?;La marzaiola;La coturnice;La beccaccia;b;;;
Che  cosa  si  intende  per  “doppio  passo”  di  una specie migratrice?;Una  rincorsa  veloce  del  migratore prima di levarsi in volo;Il modo di camminare del migratore quando si allontana senza usare le ali;Il duplice passaggio migratorio, in primavera e in autunno, sui nostri territori;c;;;
Quale di questi animali è un ungulato?;Il cinghiale;La marmotta;La volpe;a;;;
Normalmente quante volte in un anno partorisce la lepre comune in pianura?;Una, raramente due;Sei;Tre, raramente quattro;c;;;
Di cosa si nutrono in prevalenza i rapaci notturni?;Di piccoli uccelli;Di topi, ratti e altri piccoli mammiferi;Di lepri e conigli adulti;b;;;
Quale  specie  di  passero  vive  più  facilmente  a contatto con l’uomo?;La passera mattugia;La passera d’Italia;La passera oltremontana;b;;;
In natura quali animali sono più facilmente predati dai rapaci?;Quelli giovani e debilitati;Giovani e adulti indifferentemente;Quelli adulti;a;;;
Di cosa si nutre prevalentemente la volpe?;Fagiani e lepri;Galline e pollame domestico;Roditori, piccoli mammiferi e uccelli;c;;;
Quale   di   queste   anatre   di   superficie   presenta marcati sopraccigli bianchi?;La marzaiola;Il germano reale;L’alzavola;a;;;
Quale dei seguenti mammiferi è un bovide?;Il camoscio;Il cervo;Il cinghiale;a;;;
Da che cosa si stabilisce l’età nel camoscio?;Dall’esame delle corna;Dalla lunghezza del pelo;Dal colore del mantello;a;;;
Il cinghiale può ibridarsi col maiale?;Sì;No, mai;Sì, ma produce ibridi non fecondi;a;;;
Domanda;RispostaA;RispostaB;RispostaC;Risposta Esatta;;;
Perché i piccoli di taluni mammiferi come cervidi e cinghiale hanno il mantello a strisce o a macchie?;Per farsi riconoscere dagli adulti del branco;Per mimetizzarsi nell’ambiente;Per farsi riconoscere dalla madre;b;;;
Fino a quale età i cinghiali mantengono il mantello a strisce?;Fino a quattro settimane;Fino a diciotto mesi circa;Fino a sei mesi circa;c;;;
Le femmine di cervo hanno i palchi?;Sì, ma solo dal secondo anno di vita;Sì e le perdono annualmente;No, mai;c;;;
Le femmine del camoscio e dello stambecco hanno le corna e le perdono ogni anno?;Le hanno e non le perdono mai;Le hanno e le perdono ogni autunno;Le  hanno,  ma  le  perde  solo  la  femmina  di stambecco;a;;;
Come si chiama il fenomeno per cui un volatile presenta il piumaggio parzialmente o totalmente bianco?;Melanismo;Isabellismo;Albinismo;c;;;
Le femmine di muflone hanno le corna?;Si, molto evidenti;No;Raramente;c;;;
Cos’è la muta degli uccelli?;Il cambio stagionale delle penne;Una   fase   stagionale   in   cui   non cantano;La fase della cova delle uova;a;;;
Cosa sono gli ungulati?;Sono mammiferi con grande e solida unghia;Sono uccelli con lunghe unghie;Sono mammiferi privi di unghie sviluppate;a;;;
Perché alcune specie animali si dicono monogame?;Perché maschio e femmina formano coppia fissa;Perché entrambi i sessi covano;Perché ogni maschio dispone di più femmine;a;;;
L’usignolo è un insettivoro?;Sì;No;Dipende dalla stagione dell’anno;a;;;
Che tipo di cane è il setter inglese?;Cane da seguita;Cane da ferma;Cane da tana;b;;;
Che tipo di cane è il pointer?;Cane da ferma;Cane da seguita;Cane da pista di sangue;a;;;
Che tipo di cane è il segugio italiano?;Cane da cerca e riporto;Cane da seguita;Cane da ferma;b;;;
La caccia alla lepre con l’uso di quale cane di solito si effettua?;Del bracco italiano;Dello springer spaniel;Del segugio;c;;;
Dove vivono i Tetraonidi?;Nelle zone umide;Nei terreni forestali collinari;Nelle zone montane alpine;c;;;
Il cinghiale è:;Un bovide;Un fasianide;Un suide;c;;;
Il coniglio selvatico è:;Un mustelide;Un leporide;Un rallide;b;;;
Quale di questi ungulati è caducicorna?;Il cervo;Il camoscio;Il muflone;a;;;
Quali   denti   hanno   particolarmente   sviluppati   i roditori?;Gli incisivi;I premolari;I canini;a;;;
Dove vive la lepre bianca?;In zona di pianura;In zona di montagna;In zona di media collina;b;;;
In  che  mese  avviene  maggiormente  il  ripasso  o migrazione primaverile del fischione?;In marzo;In maggio;In gennaio;a;;;
Il fagiano di monte è:;Un caradriforme;Un anseriforme;Un galliforme;c;;;
In quale periodo è solitamente più abbondante il passo o migrazione autunnale della peppola?;Agosto/settembre;Gennaio/febbraio;Ottobre/novembre;c;;;
Cosa può distinguere a prima vista il maschio dalla femmina di cervo?;Il colore del mantello;Il colore della coda;La presenza di palchi;c;;;
Domanda;RispostaA;RispostaB;RispostaC;Risposta Esatta;;;
In  quale  mese  solitamente  è  più  abbondante  il passo o migrazione autunnale del tordo bottaccio?;In agosto;In settembre;In ottobre;c;;;
In  quale  mese  è  solitamente  più  abbondante  il passo o migrazione autunnale della beccaccia?;In settembre;In novembre;In gennaio;b;;;
In  quale  mese  è  solitamente  più  abbondante  il passo o migrazione autunnale dell’allodola?;In settembre;In dicembre;In ottobre;c;;;
In  quali  paesi  svernano  maggiormente  gli  uccelli migratori in Europa?;Paesi nordici;Paesi centro-meridionali;Paesi nord-orientali;b;;;
Quale   di   queste   specie   di   anatre   frequenta normalmente acque poco profonde?;La moretta;La canapiglia;Il moriglione;b;;;
Che cosa s’intende per territorialità di una specie?;La difesa del territorio che essa mette in atto;Il   territorio    che    essa    frequenta saltuariamente;Il territorio che essa occupa in inverno;a;;;
Perché gli uccelli rapaci risentono maggiormente dell’effetto dell’inquinamento da diserbanti e anticrittogamici?;Perché si trovano al vertice delle catene alimentari, quindi risentono del fenomeno di accumulo di tali veleni;Perché si alimentano in prevalenza di topi e ratti che vivono in luoghi inquinati;Perché   predano   solamente   fauna   che   si alimenta di semi di graminacee;a;;;
Quale   tra   i   seguenti   Columbidi   è   di   maggiori dimensioni:;Tortora;Colombella;Colombaccio;c;;;
Perché le femmine di molti uccelli hanno un piumaggio che si confonde  con l’ambiente in cui vivono?;Per    mimetizzarsi    e    sfuggire    ai predatori;Per farsi riconoscere dai maschi della specie;Per non farsi riconoscere dai maschi di altre specie;a;;;
Volendo effettuare un’immissione di starne, quale dei seguenti ambienti è il più idoneo?;Terreni collinari incolti e abbandonati;Foreste di pianura e pioppeti;Terreni collinari coltivati a cereali e pascoli;c;;;
Che cosa si intende per nicchia ecologica?;Il   ruolo   che   l’animale   svolge   nel proprio ambiente;L’ambiente fisico in cui vive l’animale;La   disponibilità   alimentare   che   l’ambiente offre all’animale;b;;;
Quali    specie    di    uccelli    sono    più    utili    per l’agricoltura?;Quelle onnivore;Quelle insettivore;Quelle granivore;b;;;
Quali  di  queste  specie  di  uccelli  è  autoctona  sul territorio italiano?;Il colino della Virginia;La coturnice orientale o chukar;La pernice rossa;c;;;
Quale dei seguenti uccelli frequenta normalmente una risaia?;Il beccaccino;La starna;Il tordo sassello;a;;;
Quante sono le specie di Tetraonidi che vivono sulle Alpi?;Quattro;Sei;Nove;a;;;
Il daino è:;Un cervide;Un bovide;Un suide;a;;;
Quale di queste specie di uccelli è maggiormente mimetica?;Il fringuello;La beccaccia;Il mestolone;b;;;
In  quale  periodo  dell’anno  il  camoscio  perde  le corna?;In novembre/dicembre;In gennaio/febbraio;Mai;c;;;
Domanda;RispostaA;RispostaB;RispostaC;Risposta Esatta;;;
Dove pongono il nido i Tetraonidi?;Sul terreno;Sopra i cespugli di rododendro;Sui rami di pini e abeti;a;;;
La cesena in Italia è più abbondante:;In estate;In inverno;In primavera;b;;;
Quale  parte  del  corpo  della  lepre  bianca  è  nera durante l’inverno?;Le zampe;Il naso;La punta delle orecchie;c;;;
Lo  sparviero  si  può  confondere  in  volo  con  la beccaccia?;Sì  perché  entrambi  hanno  il  becco lungo;No, perché la beccaccia è più grande;No, perché la beccaccia ha volo più lento;c;;;
Nei rapaci notturni a vista il sesso si distingue:;Non è possibile alcuna distinzione;Per il diverso piumaggio;Per la mole diversa tra maschio e femmina;a;;;
I   piccoli   di   cinghiale   fino   a   5-6   mesi   sono caratterizzati da:;Mantello di colore rossastro;Mantello di colore bruno scuro;Mantello di colore giallo dorato a strisce nere parallele;c;;;
Qual è il solo Fasianide europeo migratore?;La pernice rossa;La starna;La quaglia;c;;;
In che periodo dell’anno il piumaggio dei giovani maschi di gallo forcello si distingue nettamente da quello della madre?;Mai;Tra giugno e luglio;Verso la fine di ottobre;c;;;
Come  sono  le  corna  della  femmina  di  camoscio rispetto a quelle del maschio?;Più sottili, diritte e parallele;Più uncinate e divergenti;Più corte;a;;;
Come  si  distingue  in  volo  la  femmina  del  gallo cedrone da quella del gallo forcello?;Dal diverso piumaggio;Non occorre distinguerle poiché frequentano ambienti molto differenti;La femmina del cedrone è più grossa;c;;;
La pernice bianca frequenta prevalentemente quali tipi di habitat?;I boschi di conifere;I   pascoli   alpini   inframmezzati   da boschi di faggi e abeti;Gli ambienti d’alta quota oltre il limite della vegetazione arborea;c;;;
Tortora e upupa sono specie migratrici nidificanti in Italia: si riconoscono facilmente in volo?;Sì,   perché   la   tortora   ha   il  dorso bianco e nero;Sì, perché  la tortora tuba anche in volo;Sì,  perché  l’upupa  ha  un  caratteristico  volo sfarfallante;c;;;
Quale delle seguenti specie è un roditore?;La marmotta;Il tasso;La faina;a;;;
Quale delle seguenti specie è un mustelide?;La donnola;La marmotta;La minilepre;a;;;
Quale di questi uccelli non è un migratore?;L’alzavola;La rondine;La starna;c;;;
Quale di questi uccelli è un rapace diurno?;Il gufo comune;L’allocco;Il falco pellegrino;c;;;
Quale di questi uccelli è un insettivoro?;Il francolino di monte;Il rondone;La marzaiola;b;;;
Quale di questi uccelli non è un rapace diurno?;La poiana;L’assiolo;Il falco grillaio;b;;;
Il muflone appartiene alla famiglia dei:;Suidi;Bovidi;Cervidi;b;;;
Quale delle seguenti specie sedentarie ha collare punteggiato e sgocciolato verso il petto?;La coturnice;La starna;La pernice rossa;c;;;
Quale principale funzione svolgono le zone umide nei riguardi dell’avifauna selvatica?;Favoriscono  la  sosta  dei  migratori acquatici;Favoriscono    la    nidificazione    dei rapaci notturni;Favoriscono    la    nidificazione    della    fauna stanziale;a;;;
C’è correlazione tra ambiente e fauna selvatica?;Nessuna in particolare;Ci   sono   correlazioni   solo   in   casi particolari;Sempre;c;;;
Domanda;RispostaA;RispostaB;RispostaC;Risposta Esatta;;;
Un  ambiente  di  pianura  irrigua  a  monocoltura come può essere arricchito ai fini faunistici?;Impiantando        siepi        tra        un appezzamento e l’altro;Ricavando     pozze     d’acqua     per l’abbeverata;È ottimale, non occorre intervenire;a;;;
Cosa significa cavicorno?;Corna ramificate;Corna internamente vuote;Corna internamente piene;b;;;
Cosa significa caccia di selezione?;Una battuta di caccia con cacciatori scelti;Una caccia diretta ad abbattere determinati capi solo dopo censimenti della  popolazione oggetto di caccia;Una caccia diretta ad abbattere solo maschi o capi debilitati o malati;b;;;
Lo springer spaniel è un cane:;Da ferma;Da cerca e riporto;Da riporto;b;;;
Com’è da considerarsi la volpe?;Specie protetta da non abbattere mai;Specie dannosa da abbattere sempre;Specie cacciabile in un determinato periodo;c;;;
Quante sottospecie di lepri vivono in Lombardia?;Due;Tre;Cinque;a;;;
Quali mammiferi si cacciano in maniera classica con i cani da seguita?;Volpe e lepre;Volpe, lepre e cinghiale;Cinghiale e capriolo;b;;;
Come    si    definisce    una    collezione    di    uccelli imbalsamati?;Ornitologica;Erpetologica;Entomologica;a;;;
Il kurzhaar o bracco tedesco è un cane:;Da cerca e riporto;Da ferma;Da tana;b;;;
I cani da ferma in linea di massima, sono selezionati per cacciare quali specie di fauna selvatica?;L’avifauna stanziale;La lepre;La volpe e il cinghiale;a;;;
Quali delle seguenti specie sono cacciate in modo specifico con i cani da seguita?;Beccaccia e beccaccino;Quaglia e fagiano;Lepre e cinghiale;c;;;
Quali tra le seguenti razze canine sono più idonee a cacciare nelle paludi?;Lo spinone italiano e il setter gordon;Il pointer e il bracco italiano;Il setter inglese e il viszla;a;;;
Com’è l’andatura del pointer?;Un galoppo impetuoso;Un galoppo moderato e controllato;Un trotto allungato;a;;;
Com’è l’andatura del bracco italiano?;Un trotto;Un galoppo;Un misto di trotto e galoppo;a;;;
Che cos’è la filata?;L’attenzione del cane quando percepisce l’emanazione di un selvatico;Defilarsi del cane in allontanamento dal conduttore;Seguire  un  solco  da  un  capo  all’altro  del terreno;a;;;
Che cos’è l’accostata?;Il cane che si accosta al cacciatore;Il cane che si accosta al terreno di caccia;Il cane che avvicina il selvatico immobile dopo averlo fermato;c;;;
Che cos’è la ferma?;L’irrigidimento  del  cane  al  cospetto del selvatico;Il fermare una lepre che fugge;Fermarsi al secco richiamo del padrone;a;;;
Che cos’è la ferma in bianco?;È una ferma a vuoto;È una ferma su selvatico a vista;Fermarsi in attesa del conduttore;a;;;
Che cos’è la ferma di consenso?;Rispetto categorico di un altro cane in ferma;Fermarsi al comando del cacciatore;Fermarsi per aspettare  il cane  compagno di caccia;a;;;
Domanda;RispostaA;RispostaB;RispostaC;Risposta Esatta;;;
Che cos’è l’accostamento di un segugio?;Accostarsi al selvatico in fuga;La cerca a contatto col conduttore;Accostare un selvatico da pelo dalla pastura al covo seguendo la passata notturna;c;;;
Che cos’è la traccia?;L’impronta odorosa che un selvatico lascia sul terreno;Le vestigia notturne del selvatico;Il cammino percorso da un cane in cerca;a;;;
Che cos’è la canizza?;Coro ben orchestrato di voci di una muta che insegue;Coro di voci di segugi che accostano;Vociare     di     cani     impazienti     di     essere sguinzagliati sulla traccia;a;;;
È difetto per un segugio non dare voce sulla pastura cacciando la lepre comune?;Sì;No;È un pregio;a;;;
Come uno springer spaniel segnala la vicinanza di un selvatico?;Irrigidendosi nella ferma;Agitando freneticamente la coda;Fermandosi ad attendere il conduttore;b;;;
Qual è l’ambiente tipico della starna?;L’alta montagna;Le zone ad agricoltura intensiva;Le zone ad agricoltura differenziata;c;;;
Quale delle seguenti razze canine è utilizzata tipicamente sulla pista di sangue degli ungulati feriti?;Petit bleu de gascogne;Segugio hannoveriano;Segugio italiano;b;;;
La    lepre    comune    scava    cunicoli    e    gallerie sotterranei?;Solo    nel    periodo    invernale    per maggior riparo;Mai;Tutto l’anno;b;;;
Di  quali aree  della  Lombardia  la  pernice  rossa  è specie originaria?;Alte pianure brianzole;Colline moreniche del Garda;Appennino dell’Oltrepo pavese;c;;;
In un volatile cosa sono le remiganti?;Le penne delle ali;Le penne della coda;Le piume del corpo;a;;;
In un volatile cosa sono le timoniere?;Le penne delle ali;Le piume del corpo;Le penne della coda;c;;;
La  forma  del  becco  di  beccaccia  e  beccaccino  è tipica delle specie:;Che si alimentano di granaglie a terra;Che  si   alimentano  di   frutta  sugli alberi;Che si alimentano di invertebrati nel suolo;c;;;
Quale tra i seguenti Ungulati è detto monogastrico?;Il camoscio;Il daino;Il cinghiale;c;;;
Cosa si intende per migrazione pre-nuziale?;La migrazione autunnale;La migrazione primaverile;La migrazione tardo-estiva;b;;;
Cosa si intende per migrazione post-nuziale?;La migrazione primaverile;La migrazione autunnale;Lo spostamento nei mesi invernali;b;;;
La marzaiola sverna prevalentemente:;Nell’Europa centrale;Nell’Europa meridionale;In Africa;c;;;
Dove nidifica prevalentemente il tordo sassello?;Europa centrale;Europa settentrionale;Nordafrica;b;;;
Quale delle seguenti anatre rientra nel gruppo delle anatre di superficie?;Moretta;Alzavola;Moriglione;b;;;
Quante sono le anatre tuffatrici cacciabili in Italia?;Due;Tre;Una;a;;;
Il colombaccio è un:;Columbiforme;Anseriforme;Passeriforme;a;;;
La gazza è un:;Anseriforme;Passeriforme;Caradriforme;b;;;
La folaga è un:;Anseriforme;Caradriforme;Gruiforme;c;;;
La volpe è un:;Suide;Canide;Mustelide;b;;;
Domanda;RispostaA;RispostaB;RispostaC;;;;
In  periodo  autunnale  il  tordo  bottaccio  predilige alimentarsi di:;Semi e granaglie;Bacche spontanee e frutta;Invertebrati;b;;;
Quale delle seguenti specie appartiene alla Famiglia dei Rallidi?;Pavoncella;Porciglione;Frullino;b;;;
Quale delle seguenti specie appartiene alla Famiglia dei Corvidi?;Merlo;Ghiandaia;Gallinella d’acqua;b;;;
Il   silvilago   o   minilepre   è   specie   originaria   del continente:;Asiatico;Americano;Europeo;b;;;
Cos’è il bramito?;Il richiamo emesso dal cervo maschio in epoca pre-riproduttiva per delimitare il proprio territorio;Il richiamo emesso dal muflone maschio per radunare le proprie femmine;Il lamento emesso dal cervo maschio in punto di morte;a;;;
I palchi dei Cervidi sono di tessuto:;Cheratinoso;Osseo;Cartilagineo;b;;;
Le corna dei Bovidi sono di tessuto:;Osseo;Cheratinoso;Cartilagineo;b;;;
Il coniglio selvatico è una specie che vive:;In colonie numerose;Individualmente;A coppie;a;;;
In  quale  periodo  dell’anno  è  possibile  trovare  in tana i cuccioli di volpe?;Giugno/luglio;Settembre/ottobre;Marzo/aprile;c;;;
Che forma ha il becco negli uccelli prevalentemente granivori?;Lunga e appuntita;Conica;Piatta;b;;;
Quale delle seguenti specie ha volo più rapido?;Porciglione;Beccaccino;Allodola;b;;;
Quale delle seguenti specie acquatiche deve prendere la “rincorsa” sull’acqua prima di decollare?;Il germano reale;La canapiglia;La folaga;c;;;
Quale delle seguenti specie non è un Turdide?;Merlo;Cesena;Storno;c;;;
Si  può  lasciare  il  fucile  da  caccia  in  automobile chiusa e con l’antifurto inserito?;Sì, ma solo se scarico;Solo nei giorni di caccia consentita;No, mai, perché reato di omessa custodia;c;;;
Come si presenta l’interno di una canna rigata?;Con    rigature    perpendicolari    alla lunghezza della canna;Con rigature concentriche al vivo di volata;Con rilievi ad andamento elicoidale;c;;;
Quale di questi fucili ad anima liscia è consentito?;Fucile a cinque colpi;Fucile a quattro colpi;Fucile  con  serbatoio  in  grado  di  contenere non più di due cartucce;c;;;
Qual è la distanza media di tiro utile per un fucile a canna liscia con munizione spezzata?;35 metri;70 metri;90 metri;a;;;
Qual è la distanza di tiro eticamente accettabile per un fucile a canna rigata di medio calibro?;500 metri;200 metri;600 metri;b;;;
Domanda;RispostaA;RispostaB;RispostaC;Risposta Esatta;;;
Dove  sono  alloggiati  i  congegni  di  scatto  e  di percussione in un sovrapposto o in una doppietta?;Nella bascula;Nella camera di scoppio;Nella culatta;a;;;
A cosa serve la strozzatura massima della canna?;Ad allargare la rosata dei pallini per tiri ravvicinati;Per il tiro a palla unica;A mantenere più compatta e unita la rosata di pallini;c;;;
Quale dei seguenti fucili è vietato per la caccia in Italia?;La carabina di calibro inferiore a 5,6 mm;Il sovrapposto cal. 20;Il monocanna cal. 410;a;;;
Hanno diametro minore i pallini n. 10, n. 5 o n. 00?;Quelli del n. 10;Quelli del n. 5;Quelli del n. 00;a;;;
Come si chiama la parte posteriore della canna?;Bascula;Carcassa;Culatta;c;;;
Qual è la funzione dell’innesco in una cartuccia?;Incendiare la polvere;Contenere i pallini;Contenere la polvere;a;;;
In   periodo   di   divieto   di   caccia,   è   possibile trasportare l’arma?;Sì,     purché     muniti     di     specifica autorizzazione;Sì,   purché   scarica   e   riposta   in custodia;No;b;;;
Come si chiama la parte della canna di un fucile che contiene la cartuccia?;Anima;Volata;Camera di cartuccia;c;;;
Può essere lecitamente utilizzata un’arma da caccia appartenente a un altro cacciatore?;Sì, purché sia un fucile con canna ad anima liscia;No;Sì,  purché  a  titolo  di  prestito  o  comodato d’uso;c;;;
Quale    di    questi    componenti    è    a    contatto dell’innesco?;Il piombo;La borra;La polvere;c;;;
Che   cosa   succede   sparando   con   una   canna parzialmente otturata?;Non si incendia la polvere;Non parte il colpo;Può scoppiare la canna;c;;;
Si può utilizzare munizione spezzata per la caccia agli ungulati?;Sì, solo se a pallettoni;No;Solo su specie di taglia medio-piccola;b;;;
Per  portare  il  proprio  fucile  nei  paesi  membri dell’UE è necessario:;Fare  la  licenza  di  caccia  nello Stato estero di destinazione;Avere  il  permesso  da  parte  della Regione di residenza;Avere   ottenuto   dalla   Questura   la   Carta europea per arma da fuoco;c;;;
Nel fucile a canna rigata quali munizioni vengono impiegate?;Spezzate;A palla;Sia spezzate che a palla;b;;;
Cosa è opportuno fare per ottenere una rosata più ampia in un fucile ad anima liscia?;Usare canne cilindriche;Usare canne molto strozzate;Usare pallini di grande diametro;a;;;
A cosa corrisponde il calibro, ad esempio 12 o 20, in un fucile con canna ad anima liscia?;Al diametro della canna espresso in mm;Al peso massimo in mg della carica di polvere utilizzabile in quel fucile;Al numero di palle sferiche di diametro pari a quello della canna ricavabili da una libbra di piombo;c;;;
Qual   è   la   lunghezza   di   una   cartuccia   cal.   12 standard?;65 mm;70 mm;76 mm;b;;;
Qual   è   la   lunghezza   di   una   cartuccia   cal.   12 magnum?;70 mm;76 mm;89 mm;b;;;
Domanda;RispostaA;RispostaB;RispostaC;Risposta Esatta;;;
Perché un fucile a canna liscia cal. 16 viene indicato con tale numerazione?;Perché   il   diametro   interno   della canna misura 16 mm;Perché   il   diametro   interno   della canna misura 16 centesimi di pollice;Perché indica il numero di sfere di piombo di diametro uguale a quello della canna necessario a formare una libbra;c;;;
Per la caccia ai Turdidi quali delle seguenti cartucce sono consigliabili?;Quelle con pallini n. 3 e 4;Quelle con pallini n. 5 e 6;Quelle con pallini n. 9 e 10;c;;;
Cos’è la bindella del fucile?;La parte che consente di misurare la distanza dal selvatico;La  cinghia  per  portare  il  fucile  in spalla;Un pezzo saldato sopra la canna per facilitare la mira;c;;;
Cosa studia la balistica terminale?;Il moto del proiettile dentro la canna;Il   moto   del   proiettile   dentro   il bersaglio colpito;Il moto del proiettile nello spazio esterno;b;;;
Quali pallini è opportuno utilizzare per la caccia alla lepre comune?;Pallini n. 4;Pallini n. 0;Pallini n. 10;a;;;
Quali pallini è opportuno utilizzare per la caccia al gallo forcello?;Pallini n. 2;Pallini n. 5;Pallini n. 10;b;;;
Dovendo attraversare per breve tratto una strada comunale in Lombardia, come deve essere tenuto il fucile?;Carico ma in sicura;Scarico e nel fodero;Scarico;c;;;
I  pallini  in  acciaio  rispetto  a  quelli  in  piombo, all’impatto si deformano:;Di meno;Di più;Nella stessa misura;a;;;
Quale distanza massima di tiro può ritenersi eticamente corretta con fucile a canna rigata munito di ottica di puntamento?;1000 metri;600 metri;300 metri;c;;;
In   quale   caccia   può   essere  utile   impiegare   le cartucce dispersanti?;Nella caccia agli acquatici in botte;Nella caccia alla beccaccia nel bosco;Nella caccia alla lepre in zone aperte;b;;;
In una carabina cal. 243 il calibro è espresso in:;Millimetri;Millesimi di pollice;Libbre;b;;;
Quale dei seguenti calibri di fucile a canna liscia è consentito per la caccia?;Cal. 4;Cal. 8;Cal. 12;c;;;
Quale  di  questi  fucili  ad  anima  liscia  è  di  uso consentito in zona Alpi?;Semiautomatico a tre colpi;Semiautomatico a cinque colpi;Semiautomatico limitato a due colpi;c;;;
In quante parti si smonta un fucile ad anima liscia?;In due;In tre;In quattro;b;;;
Quale dei seguenti fucili è vietato per la caccia in Italia?;La carabina cal. 22;Il sovrapposto cal. 16;Il monocanna cal. 24;a;;;
Come  viene  detto  un  proiettile  a  palla  ricoperto parzialmente di rame?;Camiciato;A punta soffice;Blindato;b;;;
Una carabina basculante a due canne, di cui una rigata e una liscia, come viene detta?;Drilling;Automatica;Billing;c;;;
Che  carica  di  pallini  contiene  generalmente  una cartuccia supermagnum cal. 12?;46 gr;Fino a 54 gr;Più di 60 gr;c;;;
