Column1;Column2;Column3;Column4;Column5;Column6;Column7;Column8
Quale   delle   seguenti   specie   è   particolarmente protetta?;L’avvoltoio grifone;Il gallo cedrone;Il gallo forcello;a;;;
Domanda;RispostaA;RispostaB;RispostaC;Risposta Esatta;;;
Quale   delle   seguenti   specie   è   particolarmente protetta?;Il camoscio alpino;Il lupo;Il daino;b;;;
Quale   delle   seguenti   specie   è   particolarmente protetta?;La pittima reale;Il cervo;La volpoca;c;;;
Quale delle seguenti specie non è particolarmente protetta?;La cicogna;Il verdone;L’avvoltoio monaco;b;;;
Quale delle seguenti specie non è particolarmente protetta?;Il cinghiale;La martora;L’orso bruno;a;;;
Quale delle seguenti specie non è particolarmente protetta?;Il cigno reale;Il prispolone;Il lupo;b;;;
In quale periodo è cacciabile la coturnice sulle Alpi?;Dal 1° novembre all’8 dicembre;Dalla terza domenica di settembre al 31 dicembre;Dal 1° ottobre al 30 novembre;c;;;
Quale  specie  è  cacciabile  dal  1°  ottobre  al  31 dicembre o dal 1° novembre al 31 gennaio?;Il cinghiale;Il cervo;Il capriolo;a;;;
Per   quale   delle   seguenti   specie   la   caccia   in Lombardia termina l’8 dicembre?;La starna;La folaga;Il codone;a;;;
Sino a che data si può cacciare la pernice rossa in Lombardia?;31-gen;31-dic;08-dic;c;;;
La donnola è cacciabile da quale data?;Dalla terza domenica di settembre;Dall’1 novembre;Mai;c;;;
La caccia alla moretta termina il:;31-gen;31-dic;30-nov;a;;;
La caccia al coniglio selvatico termina il:;30-nov;31-dic;31-gen;b;;;
La caccia alla cesena termina il:;31-dic;15-dic;31-gen;c;;;
Quando termina la caccia alla gallinella d’acqua?;31-gen;20-gen;31-dic;a;;;
La caccia alla pernice bianca termina il:;30-nov;31-dic;31-gen;a;;;
Si può cacciare la marmotta in Lombardia?;Solo nella zona faunistica delle Alpi;Sì;No;c;;;
Quali delle seguenti specie è cacciabile fino al 31 gennaio?;Il mestolone;Il fagiano di monte;La pispola;a;;;
Quali delle seguenti specie è cacciabile fino al 31 gennaio?;L’allodola;Il coniglio selvatico;Il germano reale;c;;;
La caccia alla tortora termina il:;30-nov;31-gen;31-dic;c;;;
Qual è il periodo di caccia dell’averla maggiore?;Mai, è una specie non cacciabile;Dalla terza domenica di settembre al 31 dicembre;Dalla   terza   domenica  di  settembre   al  31 gennaio;a;;;
La caccia al fagiano è consentita:;Dalla terza domenica di settembre al 31 gennaio;Dal 1° ottobre al 1° gennaio;Dalla   terza   domenica   di   settembre   all’8 dicembre;a;;;
La caccia al beccaccino termina il:;31-dic;15-dic;31-gen;c;;;
Chi può esercitare la caccia in un fondo chiuso?;Il proprietario dei terreni;Gli agenti della vigilanza;Nessuno;c;;;
Domanda;RispostaA;RispostaB;RispostaC;Risposta Esatta;;;
Da  quale  data  è  cacciabile  la  femmina  del  gallo forcello?;Mai;Dal 1° ottobre;Dalla terza domenica di settembre;a;;;
Da quale data si può cacciare il gallo forcello?;01-ott;Terza domenica di settembre;01-nov;a;;;
Per   quale   delle   seguenti   specie   la   caccia   è consentita fino al 31 gennaio?;Il fischione;L’allodola;La quaglia;a;;;
Si può cacciare la faina?;Sì;Solo il maschio;Mai;c;;;
Si può cacciare la martora?;Sempre perché è un predatore;Mai;Dalla   terza   domenica  di  settembre   al  31 dicembre;b;;;
Si può cacciare il tasso?;Solo il maschio;Dal 1° ottobre al 30 novembre;Mai;c;;;
Sino a che data si può cacciare la marzaiola?;31-dic;15-gen;31-gen;c;;;
Sino a che data si può cacciare la volpe?;31-gen;30-nov;31-dic;a;;;
Quale delle seguenti specie è vietato abbattere?;La volpe;La pernice rossa;La taccola;c;;;
Sino a che data si può cacciare l’allodola?;31-gen;31-dic;30-nov;b;;;
Quale specie è cacciabile dal 1° ottobre al 31 dicembre con facoltà di posticipare dal  1° novembre al 31 gennaio?;Il cinghiale;Il muflone;Il camoscio;a;;;
Il codirosso è cacciabile da quale data?;Dal 1° ottobre;Dalla terza domenica di settembre;Mai;c;;;
Il merlo acquaiolo è cacciabile da quale data?;Dal 1° ottobre;Dalla terza domenica di settembre;Mai;c;;;
Il rigogolo è cacciabile da quale data?;Dal 1° settembre;Dalla terza domenica di settembre;Mai;c;;;
Quale   delle   seguenti   specie   in   Lombardia   è cacciabile sino all’8 dicembre?;La moretta;La folaga;La lepre;c;;;
Quale delle seguenti specie è cacciabile sino al 31 gennaio?;L’alzavola;Il merlo;La quaglia;a;;;
Quale delle seguenti specie è cacciabile fino al 31 gennaio?;Il verdone;Il codone;Il merlo;b;;;
Quale delle seguenti specie è cacciabile fino al 31 dicembre?;Il tordo bottaccio;La cesena;Il merlo;c;;;
Quale delle seguenti specie è cacciabile fino al 31 gennaio?;La pispola;Il moriglione;La tortora;b;;;
Quale delle seguenti specie è cacciabile dalla terza domenica di settembre al 31 gennaio?;Il colino della Virginia;La marzaiola;Il merlo;b;;;
Quale  delle  seguenti  specie  è  cacciabile  dal  1° ottobre al 30 novembre?;La lepre bianca;Il cinghiale;La lepre bruna;a;;;
Domanda;RispostaA;RispostaB;RispostaC;Risposta Esatta;;;
Quale delle seguenti specie in Lombardia è cacciabile dalla terza domenica di settembre all’8 dicembre?;La volpe;La starna;Il germano reale;b;;;
Quale  delle  seguenti  specie  è  cacciabile  dal  1 ottobre al 30 novembre?;Il cinghiale;Il fagiano;La coturnice;c;;;
Quale   delle   seguenti   specie   in   Lombardia   è cacciabile sino all’8 dicembre?;La folaga;La pernice rossa;La pavoncella;b;;;
Quale delle seguenti specie è cacciabile dalla terza domenica di settembre al 31 dicembre?;L’allodola;La canapiglia;Il fagiano;a;;;
Quale delle seguenti specie è cacciabile dalla terza domenica di settembre al 31 dicembre?;Il merlo;Il tordo bottaccio;Il frullino;a;;;
Si può cacciare il gallo cedrone?;Solo nella zona faunistica delle Alpi;Solo il maschio;È sempre vietato;c;;;
In   quale   periodo   è   consentita   la   caccia   alla canapiglia?;Dalla terza domenica di settembre al 31 dicembre;Dalla terza domenica di settembre al 31 gennaio;Mai;b;;;
Quale delle seguenti specie è cacciabile fino al 31 gennaio?;La quaglia;La folaga;La starna;b;;;
Quale delle seguenti specie è cacciabile fino al 31 gennaio?;Il camoscio alpino;La gallinella d’acqua;La pernice rossa;b;;;
Quale delle seguenti specie non è cacciabile?;Il verdone;Il tordo bottaccio;La canapiglia;a;;;
Quale  delle  seguenti  specie  non  è  cacciabile  da appostamento?;Il beccaccino;L’allodola;L’alzavola;a;;;
Quale delle seguenti specie è cacciabile nel numero massimo di 10 capi al giorno per cacciatore?;Il germano reale;La beccaccia;Il tordo sassello;a;;;
Quale delle seguenti specie è cacciabile?;Il cervo;Lo stambecco;Il lupo;a;;;
Si può cacciare il lucherino?;Mai;Dalla terza domenica di settembre al 31 dicembre;Dalla   terza   domenica  di  settembre   al  31 gennaio;a;;;
Quale delle seguenti specie non è particolarmente protetta?;Il fringuello;L’aquila reale;Il picchio verde;a;;;
Quali di questi mammiferi si può abbattere?;Il camoscio appenninico;Il camoscio alpino;L’orso bruno;b;;;
Si può abbattere la femmina del gallo forcello?;Mai;Sì, ma solo in novembre;Sì, ma solo se non accompagnata dai pulcini;a;;;
Quale delle seguenti specie non è cacciabile?;La gallinella d’acqua;La peppola;Il moriglione;b;;;
Quale delle seguenti specie è cacciabile?;La pernice bianca;La pittima minore;Lo svasso maggiore;a;;;
Quale delle seguenti specie è cacciabile?;La folaga;La strolaga mezzana;Il piviere dorato;a;;;
Col  terreno  coperto  di  neve  si  può  cacciare  il camoscio in zona Alpi?;Sì, nel periodo consentito;No;Sì,  ma  solo  se  il  terreno   è  parzialmente coperto di neve;a;;;
Domanda;RispostaA;RispostaB;RispostaC;Risposta Esatta;;;
Si può cacciare su terreni allagati da piene di fiume?;No;Sì;Solo da appostamento;a;;;
In quale di queste zone si può esercitare la caccia?;In un fondo chiuso di proprietà;Nell’ATC prescelto;In oasi di protezione;b;;;
Nelle  zone  militari  delimitate  da  tabelle  si  può cacciare?;Sì, ma solo i militari;No;Sì, ma solo da appostamento fisso;b;;;
In quale intervallo percentuale il territorio agro- silvo-pastorale regionale in zona Alpi è destinato a protezione della fauna selvatica?;Dal 10 al 20%;Dal 20 al 30%;Dal 30 al 40%;a;;;
In quale intervallo percentuale il territorio agro- silvo-pastorale regionale fuori zona Alpi è destinato a protezione della fauna selvatica?;Dal 10 al 20%;Dal 30 al 50%;Dal 20 al 30%;c;;;
A quale distanza minima occorre stare per poter sparare in direzione di una strada provinciale?;100 metri;150 metri;300 metri;b;;;
È      consentito      cacciare      il      beccaccino      da appostamento?;No;Sì, sempre;Sì, ma solo se temporaneo;a;;;
È consentito cacciare all’aspetto la beccaccia?;Mai;Sì;Solo al limite del bosco;a;;;
È   consentita   la   caccia   su   terreno   totalmente coperto da neve?;No, mai;Sì, sempre;No, salvo che in zona Alpi;c;;;
Su  uno  specchio  d’acqua  gelato  quando  si  può cacciare?;Sempre;Solo   se   non   è   in   tutto   o   nella maggior parte coperto da ghiaccio;Mai;b;;;
Quando  si  può  cacciare  la  lepre  comune  in  un vivaio?;Solo  a  scopo  di  addestramento  del cane;In nessun caso;Quando si ha il consenso del proprietario;b;;;
A quale distanza minima da una superstrada si può sparare in direzione opposta a essa?;50 metri;100 metri;150 metri;a;;;
Quando  si  può  esercitare  la  caccia  a  bordo  di autoveicoli?;Solo quando sono fermi;Mai;Solo sulle strade poderali e interpoderali;b;;;
È consentito esercitare la caccia a 80 metri da una casa?;No, la distanza minima consentita è 100 metri;No, la distanza minima consentita è 150 metri;Sì, purché si spari in direzione opposta;a;;;
È consentito sparare a bordo di un trattore?;Sì;Mai;Sì, purché non sia in movimento;b;;;
A  quale  distanza  minima  è consentito  sparare  in direzione di case, strade, posti di lavoro?;100 metri;150 metri;300 metri;b;;;
A quale distanza minima si può sparare avendo alle spalle una strada comunale?;100 metri;50 metri;150 metri;b;;;
A che distanza minima dai confini di una zona di ripopolamento e cattura si può cacciare in forma vagante?;Non c’è distanza minima;50 metri;100 metri;a;;;
Domanda;RispostaA;RispostaB;RispostaC;Risposta Esatta;;;
A che distanza minima da una zona di ripopolamento e cattura si può impiantare un appostamento fisso?;100 metri;200 metri;400 metri;c;;;
È sempre vietato esercitare la caccia:;Nelle zone adibite ad attività sportive;Su una strada poderale;Entro 1000 metri dalle funivie;a;;;
A quale distanza minima si può sparare avendo alle spalle una linea ferroviaria?;50 metri;100 metri;150 metri;a;;;
È  consentito  esercitare   la  caccia  nei  pressi  di macchine operatrici agricole in funzione?;No, mai;Sì, purché a distanza minima di 100 metri;Sì, purché si spari in direzione opposta;b;;;
In  quale  giorno  della  settimana  oltre  al  venerdì l’esercizio venatorio è sempre vietato?;Il martedì;Il mercoledì;Il giovedì;a;;;
Per quanti giorni settimanali la legge regionale consente la caccia vagante alla fauna stanziale negli ambiti territoriali di caccia?;Tre giorni a scelta esclusi i giorni di silenzio venatorio;Due  giorni  fissi  esclusi  i  giorni  di silenzio venatorio;Tre  giorni  fissi  esclusi  i  giorni  di  silenzio venatorio;a;;;
È  consentita  la  caccia  alla  lepre  comune  un’ora dopo il tramonto?;Sì;No;Solo se autorizzati dalla Polizia provinciale;b;;;
È consentita la caccia da appostamento fisso agli acquatici da due ore prima del sorgere del sole?;No;Sì;Solo dalla terza domenica di settembre al 1° ottobre;a;;;
Di quante giornate di caccia per la legge lombarda si può usufruire al massimo durante la stagione venatoria?;75;45;55;c;;;
Quando  una  festività  cade  di  martedì,  l’esercizio venatorio è consentito?;Sì;Dipende da regione a regione;No;c;;;
Possono le Regioni consentire la caccia da appostamento all’avifauna migratoria per più di tre giorni settimanali?;No, mai;Sì, sempre;Sì,   ma   solo   nel   periodo   compreso   tra  1 ottobre e 30 novembre;c;;;
La caccia è consentita sino a che ora?;Sino al tramonto, fatta eccezione per la caccia di selezione agli ungulati;Sino a un’ora dopo il tramonto;Sino al tramonto per tutte le forme di caccia;a;;;
Qual  è  l’orario  giornaliero  in  cui  è  consentita  la caccia?;Dall’alba al tramonto;Da un’ora prima del sorgere del sole al tramonto;Da  un’ora  prima  dell’alba  a  un’ora  dopo  il tramonto;b;;;
Quando si può esercitare la caccia nelle giornate di martedì e venerdì?;Quando coincidono con giorni festivi;Mai;Dipende dal calendario venatorio regionale;b;;;
Nel parco di una villa si può cacciare?;Quando il parco è cintato e chi caccia ha il consenso del proprietario;Sempre, indipendentemente da ogni autorizzazione;Mai;c;;;
Si   può   cacciare   sparando   da   un   natante   in movimento?;Solo se a motore;No;Solo se a remi;b;;;
Domanda;RispostaA;RispostaB;RispostaC;Risposta Esatta;;;
Nelle foreste demaniali l’esercizio venatorio:;È sempre vietato;È  vietato  durante  le  operazioni  di rimboschimento;È vietato, salvo in quelle che non presentino condizioni favorevoli a riproduzione e sosta della fauna;c;;;
Le trappole per la cattura di fauna selvatica:;Si possono solo detenere;Non   si   possono   né   vendere   né detenere;Si possono solo vendere;b;;;
Le reti per uccellagione:;Si possono usare;Si possono solo detenere;Non si possono né vendere né detenere;c;;;
Si può cacciare con un fucile semiautomatico cal. 12 a cinque colpi munito di riduttore fisso che ne limita l’uso a tre?;Sì, ma solo al di fuori della zona Alpi;No;Solo se autorizzati dalle competenti autorità;a;;;
È consentito l’uso del calibro 10?;No;Sì;Solo se si è appositamente autorizzati;a;;;
E’ permesso utilizzare a caccia una carabina ad aria compressa?;Sì;No;Solo da appostamento;b;;;
Chi può esercitare la caccia con la pistola?;Solo gli agenti venatori volontari;Nessuno;Solo la Polizia provinciale;b;;;
La caccia, oltre che col fucile, è consentita anche:;Col falco;Con la balestra;Con trappole a scatto;a;;;
È consentito usare bocconi avvelenati?;No;Sì;Solo agli agenti di vigilanza provinciali;a;;;
Quanti sono i colpi consentiti per un’arma da caccia a canna liscia da usare in zona Alpi?;Due;Cinque;Tre;a;;;
Si può cacciare con l’arco?;Sì;No;Solo    se    appositamente    autorizzati    dalla Regione;a;;;
Che cosa prevede la legge per l’uso a caccia di armi ad aria compressa?;Le vieta, salvo quelle a canna rigata;Le consente;Le vieta;c;;;
Si può cacciare col vischio?;Mai;Sì;Solo in pochi casi fissati dalla legge;a;;;
A  quanti  colpi  deve  essere  limitato  il  fucile  a ripetizione semiautomatica fuori della zona Alpi?;A non più di quattro colpi;A non più di tre colpi;A non più di due colpi;b;;;
Si può cacciare con la balestra?;Sì;No;Solo    se    appositamente    autorizzati    dalla Regione;b;;;
È  consentito  a  scopo  venatorio  l’uso  di  un’arma munita di silenziatore?;Sì, sempre;Solo alla Polizia provinciale;No, è sempre vietato;c;;;
Per esercitare la caccia con l’arco occorre:;La licenza di caccia;Una speciale autorizzazione;Il solo tesserino venatorio;a;;;
Dove  è  sempre  vietato  portare  armi  da  fuoco cariche?;Nella zona Alpi quando il terreno è coperto di neve;Sulle strade poderali e interpoderali;A bordo di qualunque veicolo;c;;;
Per esercitare la caccia col falco occorre:;La licenza di caccia;Una speciale autorizzazione;Il solo tesserino venatorio;a;;;
Chi ha scelto come forma di caccia in via esclusiva quella da appostamento fisso può cacciare:;Solo nel proprio appostamento;In qualsiasi appostamento fisso col consenso del titolare purché socio di almeno un ATC o CAC in regione;Solo negli appostamenti rientranti nell’ATC o CAC di appartenenza.;b;;;
È consentita la caccia a rastrello?;Sì, sempre;Sì, massimo in tre persone;No, mai;b;;;
Domanda;RispostaA;RispostaB;RispostaC;Risposta Esatta;;;
Quando si possono prendere volatili dal nido?;Per allevarli come richiami vivi;Solo quando sono idonei al volo;Solo alle condizioni previste dalla legge;c;;;
Per allevare lepri, occorre l’autorizzazione di chi?;Di nessuno;Dell’ATC competente;Della Regione;c;;;
Da quando è consentito l’allenamento e addestramento dei cani sul territorio a  caccia programmata?;Nei      trenta      giorni      antecedenti l’apertura della caccia;Dalla terza domenica di settembre;Dall’1 ottobre;a;;;
È sempre consentito l’addestramento dei cani da caccia?;Sì, ma solo negli ATC;No, solo in alcune zone e/o periodi;Sì, ma solo nei quagliodromi;b;;;
Solitamente  l’appostamento  fisso  è  costruito  con quale materiale?;Muratura o altra solida materia;Frasche e canne;Tela;a;;;
Quale  dei  seguenti  carnieri  è  consentito  in  una giornata di caccia alla migratoria?;17   tordi   bottacci,   10   merli   e   3 beccacce;12 germani, 10 colombacci e 7 tordi sasselli;9 germani e 1 alzavola;c;;;
Da chi è rilasciata l’autorizzazione per la caccia da appostamento fisso?;Dal      Comune      competente      per territorio;Dall’ATC di appartenenza;Dalla Regione;c;;;
Per   poter   impiantare   un   appostamento   fisso occorre il consenso di chi?;Del proprietario del fondo;Del conduttore del fondo;Del proprietario o del conduttore del fondo;c;;;
In un appostamento fisso, quante persone possono essere presenti al massimo per cacciare contemporaneamente?;Il titolare e altre cinque;Non più di quattro;Non c’è limite;c;;;
A quale distanza minima da un appostamento fisso in funzione, si può esercitare la caccia vagante?;100 metri;200 metri;400 metri;a;;;
A quale distanza minima da un appostamento fisso, può essere collocato un appostamento temporaneo?;200 metri;100 metri;400 metri;a;;;
A quale distanza minima da un fondo chiuso può essere impiantato un appostamento fisso?;Non c’è distanza minima;100 metri;400 metri;a;;;
È   obbligatorio   segnalare   la   cattura   di   uccelli inanellati?;No, è facoltativo;È obbligatorio;È  obbligatorio  ma  solo  per  quelli  inanellati all’estero;b;;;
Ai richiami vivi di cattura consentiti, appartiene:;La tortora;Il tordo sassello;La folaga;b;;;
Tra i richiami vivi vietati, figura:;Il beccaccino;La pavoncella;Il tordo bottaccio;a;;;
Può un agricoltore recintare il proprio fondo?;No, mai;Sì, ai sensi di legge;Solo durante la stagione venatoria;b;;;
Durante   la   caccia   da   appostamento   fisso   è consentito l’uso:;Di   stampi   in   plastica   riproducenti specie cacciabili e non cacciabili;Della civetta viva;Di  uccelli  imbalsamati  di  specie  cacciabili  e non cacciabili;a;;;
Chiunque può esercitare la tassidermia?;Sì, purché tecnicamente preparato;Nessuno, è un’attività vietata;No, solo chi appositamente autorizzato;c;;;
Domanda;RispostaA;RispostaB;RispostaC;Risposta Esatta;;;
Ogni    cacciatore    che    eserciti    la    caccia    da appostamento fisso può utilizzare:;Un numero massimo di richiami vivi di cattura illimitato, di cui non più di 8 per specie consentita;Un numero massimo di richiami vivi di allevamento non superiore a 30;Un numero massimo di richiami vivi di cattura non superiore a 40, di cui non più di 10 per specie consentita;c;;;
È  vietato  l’uso  di  richiami  vivi  che  non  siano identificabili:;Mediante anellino inamovibile;Mediante collarino;Mediante   un   contrassegno   applicato   sulla gabbietta;a;;;
La  Regione  può  rilasciare  autorizzazioni  per  la caccia da appostamento fisso:;A    tutti    coloro    che    ne    facciano richiesta in tempo utile;Solo a chi abbia compiuto 60 anni di età;A tutti coloro che ne facciano richiesta e ne abbiano i requisiti di legge;c;;;
Chi  istituisce  le  oasi  di  protezione  e  le  zone  di ripopolamento e cattura?;Il Comune competente per territorio;La Regione;L’ATC;b;;;
In una zona di ripopolamento  e cattura,  chi può catturare la fauna stanziale?;I proprietari dei terreni;Nessuno;La Regione tramite il personale preposto;c;;;
Nelle  zone  di  ripopolamento  e  cattura  a  chi  è permessa la caccia?;Ai residenti nei comuni inclusi nella zona;Agli agenti della Polizia provinciale;A nessuno;c;;;
Nelle oasi di protezione si possono cacciare:;I Corvidi;Il cinghiale e la volpe;La caccia è sempre vietata a chiunque;c;;;
Che cosa sono le riserve naturali?;Aree naturali protette dove la caccia è sempre vietata;Aree a caccia riservata;Aree destinate alla tutela dell’agricoltura;a;;;
È consentito esercitare la caccia nei centri privati di riproduzione della fauna selvatica?;Solo   a   chi   ha   il   permesso   del proprietario;Sì;No, a nessuno;c;;;
Cosa sono gli osservatori ornitologici?;Stazioni per lo studio delle migrazioni degli uccelli;Particolari    appostamenti    fissi    di caccia;Luoghi di sosta idonei per gli uccelli migratori;a;;;
Per aziende agri-turistico venatorie si intende:;Zone di turismo agricolo e forestale;Zone destinate all’allevamento di fauna selvatica da immettere sui fondi agricoli;Zone     di     caccia     private     istituite     per l’integrazione del reddito agricolo;c;;;
Che cos’è l’ISPRA?;È l’organo tecnico nazionale istituito fra le associazioni venatorie;È l’organo nazionale di consulenza tecnico-scientifico in materia di gestione faunistico-venatoria;È l’istituto nazionale per la gestione delle aree naturali protette;b;;;
Quale   dei   seguenti   istituti   ha   competenze   in materia di caccia?;L’Istituto   territoriale   per   la   fauna selvatica;L’Ente     regionale     per     i     servizi all’agricoltura e alle foreste;L’ISPRA;c;;;
Il Comitato  tecnico  faunistico-venatorio  nazionale ha il compito:;Di    approvare    leggi    in    materia venatoria;Di definire gli ATC e i CAC;Di   esprimere   pareri   inerenti   la   corretta applicazione della legislazione venatoria;c;;;
Il Ministero delle politiche agricole:;Deve aggiornare ogni quattro anni i massimali delle polizze assicurative;Può vietare la caccia a talune specie;Autorizza la cattura dei richiami vivi;a;;;
La  tassa  di  concessione  regionale  per  l’esercizio venatorio ha validità:;Annuale;Biennale;Dura quanto la stagione venatoria;a;;;
Il Ministero dei Trasporti:;Può vietare la caccia lungo le ferrovie;Autorizza  l’abbattimento  di  specie selvatiche sulla rete autostradale;Controlla il livello delle popolazioni di uccelli negli aeroporti;c;;;
Domanda;RispostaA;RispostaB;RispostaC;Risposta Esatta;;;
Il Ministero della Salute:;Può   vietare   la   caccia   in   caso   di epidemie;Autorizza   le   autorità   sanitarie   al controllo dei predatori;Stabilisce i requisiti psico-fisici per il rilascio del certificato medico per il porto di fucile a uso caccia;c;;;
Le Regioni dispongono:;Il divieto di caccia da appostamento con richiami vivi;Le modifiche alle sanzioni penali;Le norme per il soccorso della fauna selvatica in difficoltà;c;;;
Per direttive UE si intendono:;Le  disposizioni  emanate  dagli  Stati aderenti all’UE;Le disposizioni emanate da altri Stati nei confronti di quelli dell’UE;Le disposizioni emanate dall’Unione Europea;c;;;
Quale  tra  i  seguenti  compiti in materia  di caccia spetta alla Giunta regionale?;Predisporre le disposizioni integrative al calendario venatorio;Organizzare le gare cinofile regionali;Modificare         l’elenco         delle         specie particolarmente protette;a;;;
Qual è l’organo legislativo della Regione?;Il Consiglio regionale;La Giunta regionale;La consulta faunistico-venatoria regionale;a;;;
Che   cosa   fa   il   Consiglio   regionale   in   materia venatoria?;Autorizza la caccia nei fondi chiusi;Approva le disposizioni integrative al calendario venatorio;Emana leggi;c;;;
Chi  stabilisce  i  calendari  e  i  luoghi  delle  prove cinofile in determinate aree a divieto di caccia?;I gruppi cinofili con l’ENCI;La Regione con l’ENCI;I gruppi cinofili;b;;;
Che cosa è la licenza di caccia?;È il documento sul quale vanno annotati le giornate di caccia e i capi abbattuti;È la polizza assicurativa;È il documento che autorizza il porto di fucile a uso caccia;c;;;
Cosa si intende per tesserino venatorio regionale?;Il documento sul quale il cacciatore deve segnare ogni giornata di caccia e i relativi capi abbattuti;Il    regolamento    annuale    per    la gestione del prelievo venatorio;Il  documento  sul  quale  il  cacciatore  deve segnare la regione dove si trova a caccia;a;;;
Quale   ente   può   catturare   lepri   nelle   zone   di ripopolamento e cattura?;La Regione;Nessun ente;Il Comune;a;;;
Che cosa è un’associazione venatoria?;Un’organizzazione che redige le norme del calendario venatorio annuale;Un libero sodalizio di cacciatori;Un’organizzazione  che  emana  i  regolamenti venatori;b;;;
Che compiti hanno le associazioni venatorie?;Emanare leggi e regolamenti venatori;Predisporre     l’annuale     calendario venatorio;Rappresentare e organizzare i cacciatori;c;;;
Da chi sono riconosciute le associazioni venatorie?;Dal    Comitato    tecnico    faunistico- venatorio nazionale;Dall’ISPRA;Dal Ministero delle politiche agricole;c;;;
Un’associazione   venatoria   può   avere   agenti   di vigilanza venatoria?;Sì;No;Solo dopo apposita autorizzazione regionale;a;;;
Quali categorie di  portatori  d’interessi  sono rappresentate nei comitati di gestione degli ATC e dei CAC?;Cacciatori e agricoltori;Cacciatori, agricoltori e protezionisti;Cacciatori;b;;;
Che cos’è un fondo chiuso?;Un allevamento di fauna stanziale;Un terreno privato di caccia;Un appezzamento di terreno recintato ai sensi di legge;c;;;
Domanda;RispostaA;RispostaB;RispostaC;Risposta Esatta;;;
Per   esercitare   la   caccia   è   obbligatorio   essere assicurati per responsabilità civile verso terzi?;No, è facoltativo;Sì ma solo finché si è inesperti nel maneggio delle armi;Sì, è obbligatorio;c;;;
